	captured_length	eth_dst	eth_src	highest_layer	info_line	interface_captured	ip_dst	ip_src	length	number	project_id	sniff_timestamp	tcp_dstport	tcp_srcport	tcp_stream
0	62	00:30:48:62:4e:4a	00:08:e2:3b:56:01	TCP	1821→445 [SYN] Seq=0 Win=64240 Len=0 MSS=1460 SACK_PERM=1		192.150.11.111	98.114.205.102	62	1	2	2009-04-20 06:28:28	445	1821	0
1	62	00:08:e2:3b:56:01	00:30:48:62:4e:4a	TCP	445 > 1821 [SYN, ACK] Seq=0 Ack=1 Win=5840 Len=0 MSS=1460 SACK_PERM=1		98.114.205.102	192.150.11.111	62	2	2	2009-04-20 06:28:28	1821	445	0
2	60	00:30:48:62:4e:4a	00:08:e2:3b:56:01	TCP	1821 > 445 [ACK] Seq=1 Ack=1 Win=64240 Len=0		192.150.11.111	98.114.205.102	60	3	2	2009-04-20 06:28:28	445	1821	0
3	60	00:30:48:62:4e:4a	00:08:e2:3b:56:01	TCP	1821 > 445 [FIN, ACK] Seq=1 Ack=1 Win=64240 Len=0		192.150.11.111	98.114.205.102	60	4	2	2009-04-20 06:28:28	445	1821	0
4	62	00:30:48:62:4e:4a	00:08:e2:3b:56:01	TCP	1828 > 445 [SYN] Seq=0 Win=64240 Len=0 MSS=1460 SACK_PERM=1		192.150.11.111	98.114.205.102	62	5	2	2009-04-20 06:28:28	445	1828	1
5	62	00:08:e2:3b:56:01	00:30:48:62:4e:4a	TCP	445 > 1828 [SYN, ACK] Seq=0 Ack=1 Win=5840 Len=0 MSS=1460 SACK_PERM=1		98.114.205.102	192.150.11.111	62	6	2	2009-04-20 06:28:28	1828	445	1
6	54	00:08:e2:3b:56:01	00:30:48:62:4e:4a	TCP	445 > 1821 [ACK] Seq=1 Ack=2 Win=5840 Len=0		98.114.205.102	192.150.11.111	54	7	2	2009-04-20 06:28:28	1821	445	0
7	54	00:08:e2:3b:56:01	00:30:48:62:4e:4a	TCP	445 > 1821 [FIN, ACK] Seq=1 Ack=2 Win=5840 Len=0		98.114.205.102	192.150.11.111	54	8	2	2009-04-20 06:28:28	1821	445	0
8	60	00:30:48:62:4e:4a	00:08:e2:3b:56:01	TCP	1828 > 445 [ACK] Seq=1 Ack=1 Win=64240 Len=0		192.150.11.111	98.114.205.102	60	9	2	2009-04-20 06:28:28	445	1828	1
9	191	00:30:48:62:4e:4a	00:08:e2:3b:56:01	SMB	Negotiate Protocol Request		192.150.11.111	98.114.205.102	191	10	2	2009-04-20 06:28:28	445	1828	1
10	54	00:08:e2:3b:56:01	00:30:48:62:4e:4a	TCP	445 > 1828 [ACK] Seq=1 Ack=138 Win=6432 Len=0		98.114.205.102	192.150.11.111	54	11	2	2009-04-20 06:28:28	1828	445	1
11	60	00:30:48:62:4e:4a	00:08:e2:3b:56:01	TCP	1821 > 445 [ACK] Seq=2 Ack=2 Win=64240 Len=0		192.150.11.111	98.114.205.102	60	12	2	2009-04-20 06:28:28	445	1821	0
12	143	00:08:e2:3b:56:01	00:30:48:62:4e:4a	SMB	Negotiate Protocol Response		98.114.205.102	192.150.11.111	143	13	2	2009-04-20 06:28:28	1828	445	1
13	222	00:30:48:62:4e:4a	00:08:e2:3b:56:01	SMB	Session Setup AndX Request, NTLMSSP_NEGOTIATE		192.150.11.111	98.114.205.102	222	14	2	2009-04-20 06:28:28	445	1828	1
14	54	00:08:e2:3b:56:01	00:30:48:62:4e:4a	TCP	445 > 1828 [ACK] Seq=90 Ack=306 Win=7504 Len=0		98.114.205.102	192.150.11.111	54	15	2	2009-04-20 06:28:28	1828	445	1
15	311	00:08:e2:3b:56:01	00:30:48:62:4e:4a	SMB	Session Setup AndX Response, NTLMSSP_CHALLENGE, Error: STATUS_MORE_PROCESSING_REQUIRED		98.114.205.102	192.150.11.111	311	16	2	2009-04-20 06:28:29	1828	445	1
16	276	00:30:48:62:4e:4a	00:08:e2:3b:56:01	SMB	Session Setup AndX Request, NTLMSSP_AUTH, User: \		192.150.11.111	98.114.205.102	276	17	2	2009-04-20 06:28:29	445	1828	1
17	54	00:08:e2:3b:56:01	00:30:48:62:4e:4a	TCP	445 > 1828 [ACK] Seq=347 Ack=528 Win=8576 Len=0		98.114.205.102	192.150.11.111	54	18	2	2009-04-20 06:28:29	1828	445	1
18	175	00:08:e2:3b:56:01	00:30:48:62:4e:4a	SMB	Session Setup AndX Response		98.114.205.102	192.150.11.111	175	19	2	2009-04-20 06:28:29	1828	445	1
19	152	00:30:48:62:4e:4a	00:08:e2:3b:56:01	SMB	Tree Connect AndX Request, Path: \\192.150.11.111\ipc$		192.150.11.111	98.114.205.102	152	20	2	2009-04-20 06:28:29	445	1828	1
20	54	00:08:e2:3b:56:01	00:30:48:62:4e:4a	TCP	445 > 1828 [ACK] Seq=468 Ack=626 Win=8576 Len=0		98.114.205.102	192.150.11.111	54	21	2	2009-04-20 06:28:29	1828	445	1
21	114	00:08:e2:3b:56:01	00:30:48:62:4e:4a	SMB	Tree Connect AndX Response		98.114.205.102	192.150.11.111	114	22	2	2009-04-20 06:28:29	1828	445	1
22	158	00:30:48:62:4e:4a	00:08:e2:3b:56:01	SMB	NT Create AndX Request, Path: \lsarpc		192.150.11.111	98.114.205.102	158	23	2	2009-04-20 06:28:29	445	1828	1
23	54	00:08:e2:3b:56:01	00:30:48:62:4e:4a	TCP	445 > 1828 [ACK] Seq=528 Ack=730 Win=8576 Len=0		98.114.205.102	192.150.11.111	54	24	2	2009-04-20 06:28:29	1828	445	1
24	193	00:08:e2:3b:56:01	00:30:48:62:4e:4a	SMB	NT Create AndX Response, FID: 0x4000		98.114.205.102	192.150.11.111	193	25	2	2009-04-20 06:28:29	1828	445	1
25	214	00:30:48:62:4e:4a	00:08:e2:3b:56:01	DCERPC	Bind: call_id: 1, Fragment: Single, 1 context items: DSSETUP V0.0 (32bit NDR)		192.150.11.111	98.114.205.102	214	26	2	2009-04-20 06:28:29	445	1828	1
26	54	00:08:e2:3b:56:01	00:30:48:62:4e:4a	TCP	445 > 1828 [ACK] Seq=667 Ack=890 Win=9648 Len=0		98.114.205.102	192.150.11.111	54	27	2	2009-04-20 06:28:29	1828	445	1
27	182	00:08:e2:3b:56:01	00:30:48:62:4e:4a	DCERPC	Bind_ack: call_id: 1, Fragment: Single, max_xmit: 4280 max_recv: 4280, 1 results: Acceptance		98.114.205.102	192.150.11.111	182	28	2	2009-04-20 06:28:30	1828	445	1
28	1514	00:30:48:62:4e:4a	00:08:e2:3b:56:01	TCP	[TCP segment of a reassembled PDU]		192.150.11.111	98.114.205.102	1514	29	2	2009-04-20 06:28:30	445	1828	1
29	54	00:08:e2:3b:56:01	00:30:48:62:4e:4a	TCP	445 > 1828 [ACK] Seq=795 Ack=2350 Win=11680 Len=0		98.114.205.102	192.150.11.111	54	30	2	2009-04-20 06:28:30	1828	445	1
30	1514	00:30:48:62:4e:4a	00:08:e2:3b:56:01	TCP	[TCP segment of a reassembled PDU]		192.150.11.111	98.114.205.102	1514	31	2	2009-04-20 06:28:30	445	1828	1
31	54	00:08:e2:3b:56:01	00:30:48:62:4e:4a	TCP	445 > 1828 [ACK] Seq=795 Ack=3810 Win=14600 Len=0		98.114.205.102	192.150.11.111	54	32	2	2009-04-20 06:28:30	1828	445	1
32	454	00:30:48:62:4e:4a	00:08:e2:3b:56:01	DSSETUP	DsRoleUpgradeDownlevelServer request[Long frame (3208 bytes)]		192.150.11.111	98.114.205.102	454	33	2	2009-04-20 06:28:30	445	1828	1
33	54	00:08:e2:3b:56:01	00:30:48:62:4e:4a	TCP	445 > 1828 [ACK] Seq=795 Ack=4210 Win=17520 Len=0		98.114.205.102	192.150.11.111	54	34	2	2009-04-20 06:28:30	1828	445	1
34	60	00:30:48:62:4e:4a	00:08:e2:3b:56:01	TCP	[TCP Dup ACK 33#1] 1828 > 445 [ACK] Seq=4210 Ack=795 Win=63446 Len=0		192.150.11.111	98.114.205.102	60	35	2	2009-04-20 06:28:30	445	1828	1
35	62	00:30:48:62:4e:4a	00:08:e2:3b:56:01	TCP	1924 > 1957 [SYN] Seq=0 Win=64240 Len=0 MSS=1460 SACK_PERM=1		192.150.11.111	98.114.205.102	62	36	2	2009-04-20 06:28:30	1957	1924	2
36	62	00:08:e2:3b:56:01	00:30:48:62:4e:4a	TCP	1957 > 1924 [SYN, ACK] Seq=0 Ack=1 Win=5840 Len=0 MSS=1460 SACK_PERM=1		98.114.205.102	192.150.11.111	62	37	2	2009-04-20 06:28:30	1924	1957	2
37	162	00:08:e2:3b:56:01	00:30:48:62:4e:4a	DSSETUP	DsRoleUpgradeDownlevelServer response[Long frame (20 bytes)]		98.114.205.102	192.150.11.111	162	38	2	2009-04-20 06:28:30	1828	445	1
38	60	00:30:48:62:4e:4a	00:08:e2:3b:56:01	TCP	1924 > 1957 [ACK] Seq=1 Ack=1 Win=64240 Len=0		192.150.11.111	98.114.205.102	60	39	2	2009-04-20 06:28:30	1957	1924	2
39	60	00:30:48:62:4e:4a	00:08:e2:3b:56:01	TCP	1828 > 445 [ACK] Seq=4210 Ack=903 Win=63338 Len=0		192.150.11.111	98.114.205.102	60	40	2	2009-04-20 06:28:30	445	1828	1
40	55	00:08:e2:3b:56:01	00:30:48:62:4e:4a	DATA	1957 > 1924 [PSH, ACK] Seq=1 Ack=1 Win=5840 Len=1		98.114.205.102	192.150.11.111	55	41	2	2009-04-20 06:28:31	1924	1957	2
41	177	00:30:48:62:4e:4a	00:08:e2:3b:56:01	DATA	1924 > 1957 [PSH, ACK] Seq=1 Ack=2 Win=64239 Len=123		192.150.11.111	98.114.205.102	177	42	2	2009-04-20 06:28:31	1957	1924	2
42	54	00:08:e2:3b:56:01	00:30:48:62:4e:4a	TCP	1957 > 1924 [ACK] Seq=2 Ack=124 Win=5840 Len=0		98.114.205.102	192.150.11.111	54	43	2	2009-04-20 06:28:31	1924	1957	2
43	64	00:30:48:62:4e:4a	00:08:e2:3b:56:01	DATA	1924 > 1957 [PSH, ACK] Seq=124 Ack=2 Win=64239 Len=10		192.150.11.111	98.114.205.102	64	44	2	2009-04-20 06:28:32	1957	1924	2
44	54	00:08:e2:3b:56:01	00:30:48:62:4e:4a	TCP	1957 > 1924 [ACK] Seq=2 Ack=134 Win=5840 Len=0		98.114.205.102	192.150.11.111	54	45	2	2009-04-20 06:28:32	1924	1957	2
45	55	00:08:e2:3b:56:01	00:30:48:62:4e:4a	DATA	1957 > 1924 [PSH, ACK] Seq=2 Ack=134 Win=5840 Len=1		98.114.205.102	192.150.11.111	55	46	2	2009-04-20 06:28:33	1924	1957	2
46	60	00:30:48:62:4e:4a	00:08:e2:3b:56:01	TCP	1924 > 1957 [FIN, ACK] Seq=134 Ack=3 Win=64238 Len=0		192.150.11.111	98.114.205.102	60	47	2	2009-04-20 06:28:33	1957	1924	2
47	54	00:08:e2:3b:56:01	00:30:48:62:4e:4a	TCP	1957 > 1924 [FIN, ACK] Seq=3 Ack=135 Win=5840 Len=0		98.114.205.102	192.150.11.111	54	48	2	2009-04-20 06:28:33	1924	1957	2
48	60	00:30:48:62:4e:4a	00:08:e2:3b:56:01	TCP	1828 > 445 [RST] Seq=4210 Win=0 Len=0		192.150.11.111	98.114.205.102	60	49	2	2009-04-20 06:28:33	445	1828	1
49	74	00:08:e2:3b:56:01	00:30:48:62:4e:4a	TCP	36296 > 8884 [SYN] Seq=0 Win=5840 Len=0 MSS=1460 SACK_PERM=1 TSval=4055633882 TSecr=0 WS=128		98.114.205.102	192.150.11.111	74	50	2	2009-04-20 06:28:33	8884	36296	3
50	60	00:30:48:62:4e:4a	00:08:e2:3b:56:01	TCP	1924 > 1957 [ACK] Seq=135 Ack=4 Win=64238 Len=0		192.150.11.111	98.114.205.102	60	51	2	2009-04-20 06:28:33	1957	1924	2
51	78	00:30:48:62:4e:4a	00:08:e2:3b:56:01	TCP	8884 > 36296 [SYN, ACK] Seq=0 Ack=1 Win=64240 Len=0 MSS=1460 WS=1 TSval=0 TSecr=0 SACK_PERM=1		192.150.11.111	98.114.205.102	78	52	2	2009-04-20 06:28:33	36296	8884	3
52	66	00:08:e2:3b:56:01	00:30:48:62:4e:4a	TCP	36296 > 8884 [ACK] Seq=1 Ack=1 Win=5888 Len=0 TSval=4055633911 TSecr=0		98.114.205.102	192.150.11.111	66	53	2	2009-04-20 06:28:33	8884	36296	3
53	87	00:30:48:62:4e:4a	00:08:e2:3b:56:01	DATA	8884 > 36296 [PSH, ACK] Seq=1 Ack=1 Win=64240 Len=21 TSval=438613 TSecr=4055633911		192.150.11.111	98.114.205.102	87	54	2	2009-04-20 06:28:33	36296	8884	3
54	66	00:08:e2:3b:56:01	00:30:48:62:4e:4a	TCP	36296 > 8884 [ACK] Seq=1 Ack=22 Win=5888 Len=0 TSval=4055633948 TSecr=438613		98.114.205.102	192.150.11.111	66	55	2	2009-04-20 06:28:33	8884	36296	3
55	74	00:08:e2:3b:56:01	00:30:48:62:4e:4a	DATA	36296 > 8884 [PSH, ACK] Seq=1 Ack=22 Win=5888 Len=8 TSval=4055633948 TSecr=438613		98.114.205.102	192.150.11.111	74	56	2	2009-04-20 06:28:33	8884	36296	3
56	88	00:30:48:62:4e:4a	00:08:e2:3b:56:01	DATA	8884 > 36296 [PSH, ACK] Seq=22 Ack=9 Win=64232 Len=22 TSval=438614 TSecr=4055633948		192.150.11.111	98.114.205.102	88	57	2	2009-04-20 06:28:33	36296	8884	3
57	74	00:08:e2:3b:56:01	00:30:48:62:4e:4a	DATA	36296 > 8884 [PSH, ACK] Seq=9 Ack=44 Win=5888 Len=8 TSval=4055633980 TSecr=438614		98.114.205.102	192.150.11.111	74	58	2	2009-04-20 06:28:33	8884	36296	3
58	86	00:30:48:62:4e:4a	00:08:e2:3b:56:01	DATA	8884 > 36296 [PSH, ACK] Seq=44 Ack=17 Win=64224 Len=20 TSval=438616 TSecr=4055633980		192.150.11.111	98.114.205.102	86	59	2	2009-04-20 06:28:33	36296	8884	3
59	72	00:08:e2:3b:56:01	00:30:48:62:4e:4a	DATA	36296 > 8884 [PSH, ACK] Seq=17 Ack=64 Win=5888 Len=6 TSval=4055634012 TSecr=438616		98.114.205.102	192.150.11.111	72	60	2	2009-04-20 06:28:33	8884	36296	3
60	79	00:30:48:62:4e:4a	00:08:e2:3b:56:01	DATA	8884 > 36296 [PSH, ACK] Seq=64 Ack=23 Win=64218 Len=13 TSval=438617 TSecr=4055634012		192.150.11.111	98.114.205.102	79	61	2	2009-04-20 06:28:34	36296	8884	3
61	74	00:08:e2:3b:56:01	00:30:48:62:4e:4a	DATA	36296 > 8884 [PSH, ACK] Seq=23 Ack=77 Win=5888 Len=8 TSval=4055634045 TSecr=438617		98.114.205.102	192.150.11.111	74	62	2	2009-04-20 06:28:34	8884	36296	3
62	85	00:30:48:62:4e:4a	00:08:e2:3b:56:01	DATA	8884 > 36296 [PSH, ACK] Seq=77 Ack=31 Win=64210 Len=19 TSval=438618 TSecr=4055634045		192.150.11.111	98.114.205.102	85	63	2	2009-04-20 06:28:34	36296	8884	3
63	92	00:08:e2:3b:56:01	00:30:48:62:4e:4a	DATA	36296 > 8884 [PSH, ACK] Seq=31 Ack=96 Win=5888 Len=26 TSval=4055634079 TSecr=438618		98.114.205.102	192.150.11.111	92	64	2	2009-04-20 06:28:34	8884	36296	3
64	95	00:30:48:62:4e:4a	00:08:e2:3b:56:01	DATA	8884 > 36296 [PSH, ACK] Seq=96 Ack=57 Win=64184 Len=29 TSval=438620 TSecr=4055634079		192.150.11.111	98.114.205.102	95	65	2	2009-04-20 06:28:34	36296	8884	3
65	81	00:08:e2:3b:56:01	00:30:48:62:4e:4a	DATA	36296 > 8884 [PSH, ACK] Seq=57 Ack=125 Win=5888 Len=15 TSval=4055634113 TSecr=438620		98.114.205.102	192.150.11.111	81	66	2	2009-04-20 06:28:34	8884	36296	3
66	106	00:30:48:62:4e:4a	00:08:e2:3b:56:01	DATA	8884 > 36296 [PSH, ACK] Seq=125 Ack=72 Win=64169 Len=40 TSval=438621 TSecr=4055634113		192.150.11.111	98.114.205.102	106	67	2	2009-04-20 06:28:34	36296	8884	3
67	62	00:30:48:62:4e:4a	00:08:e2:3b:56:01	TCP	2152 > 1080 [SYN] Seq=0 Win=64240 Len=0 MSS=1460 SACK_PERM=1		192.150.11.111	98.114.205.102	62	68	2	2009-04-20 06:28:34	1080	2152	4
68	62	00:08:e2:3b:56:01	00:30:48:62:4e:4a	TCP	1080 > 2152 [SYN, ACK] Seq=0 Ack=1 Win=5840 Len=0 MSS=1460 SACK_PERM=1		98.114.205.102	192.150.11.111	62	69	2	2009-04-20 06:28:34	2152	1080	4
69	66	00:08:e2:3b:56:01	00:30:48:62:4e:4a	TCP	36296 > 8884 [ACK] Seq=72 Ack=165 Win=5888 Len=0 TSval=4055634156 TSecr=438621		98.114.205.102	192.150.11.111	66	70	2	2009-04-20 06:28:34	8884	36296	3
70	60	00:30:48:62:4e:4a	00:08:e2:3b:56:01	TCP	2152 > 1080 [ACK] Seq=1 Ack=1 Win=64240 Len=0		192.150.11.111	98.114.205.102	60	71	2	2009-04-20 06:28:34	1080	2152	4
71	1078	00:30:48:62:4e:4a	00:08:e2:3b:56:01	SOCKS	Unknown		192.150.11.111	98.114.205.102	1078	72	2	2009-04-20 06:28:34	1080	2152	4
72	54	00:08:e2:3b:56:01	00:30:48:62:4e:4a	TCP	1080 > 2152 [ACK] Seq=1 Ack=1025 Win=7168 Len=0		98.114.205.102	192.150.11.111	54	73	2	2009-04-20 06:28:34	2152	1080	4
73	1514	00:30:48:62:4e:4a	00:08:e2:3b:56:01	SOCKS	Unknown		192.150.11.111	98.114.205.102	1514	74	2	2009-04-20 06:28:34	1080	2152	4
74	54	00:08:e2:3b:56:01	00:30:48:62:4e:4a	TCP	1080 > 2152 [ACK] Seq=1 Ack=2485 Win=10220 Len=0		98.114.205.102	192.150.11.111	54	75	2	2009-04-20 06:28:34	2152	1080	4
75	490	00:30:48:62:4e:4a	00:08:e2:3b:56:01	SOCKS	Unknown		192.150.11.111	98.114.205.102	490	76	2	2009-04-20 06:28:34	1080	2152	4
76	54	00:08:e2:3b:56:01	00:30:48:62:4e:4a	TCP	1080 > 2152 [ACK] Seq=1 Ack=2921 Win=13140 Len=0		98.114.205.102	192.150.11.111	54	77	2	2009-04-20 06:28:34	2152	1080	4
77	1514	00:30:48:62:4e:4a	00:08:e2:3b:56:01	SOCKS	Unknown		192.150.11.111	98.114.205.102	1514	78	2	2009-04-20 06:28:34	1080	2152	4
78	54	00:08:e2:3b:56:01	00:30:48:62:4e:4a	TCP	1080 > 2152 [ACK] Seq=1 Ack=4381 Win=16060 Len=0		98.114.205.102	192.150.11.111	54	79	2	2009-04-20 06:28:34	2152	1080	4
79	1078	00:30:48:62:4e:4a	00:08:e2:3b:56:01	SOCKS	Unknown		192.150.11.111	98.114.205.102	1078	80	2	2009-04-20 06:28:34	1080	2152	4
80	54	00:08:e2:3b:56:01	00:30:48:62:4e:4a	TCP	1080 > 2152 [ACK] Seq=1 Ack=5405 Win=18980 Len=0		98.114.205.102	192.150.11.111	54	81	2	2009-04-20 06:28:34	2152	1080	4
81	1514	00:30:48:62:4e:4a	00:08:e2:3b:56:01	SOCKS	Unknown		192.150.11.111	98.114.205.102	1514	82	2	2009-04-20 06:28:34	1080	2152	4
82	54	00:08:e2:3b:56:01	00:30:48:62:4e:4a	TCP	1080 > 2152 [ACK] Seq=1 Ack=6865 Win=21900 Len=0		98.114.205.102	192.150.11.111	54	83	2	2009-04-20 06:28:34	2152	1080	4
83	1382	00:30:48:62:4e:4a	00:08:e2:3b:56:01	SOCKS	Unknown		192.150.11.111	98.114.205.102	1382	84	2	2009-04-20 06:28:34	1080	2152	4
84	54	00:08:e2:3b:56:01	00:30:48:62:4e:4a	TCP	1080 > 2152 [ACK] Seq=1 Ack=8193 Win=24820 Len=0		98.114.205.102	192.150.11.111	54	85	2	2009-04-20 06:28:34	2152	1080	4
85	1514	00:30:48:62:4e:4a	00:08:e2:3b:56:01	SOCKS	Unknown		192.150.11.111	98.114.205.102	1514	86	2	2009-04-20 06:28:34	1080	2152	4
86	54	00:08:e2:3b:56:01	00:30:48:62:4e:4a	TCP	1080 > 2152 [ACK] Seq=1 Ack=9653 Win=27740 Len=0		98.114.205.102	192.150.11.111	54	87	2	2009-04-20 06:28:34	2152	1080	4
87	622	00:30:48:62:4e:4a	00:08:e2:3b:56:01	SOCKS	Unknown		192.150.11.111	98.114.205.102	622	88	2	2009-04-20 06:28:34	1080	2152	4
88	54	00:08:e2:3b:56:01	00:30:48:62:4e:4a	TCP	1080 > 2152 [ACK] Seq=1 Ack=10221 Win=30660 Len=0		98.114.205.102	192.150.11.111	54	89	2	2009-04-20 06:28:34	2152	1080	4
89	74	00:30:48:62:4e:4a	00:08:e2:3b:56:01	SOCKS	Unknown		192.150.11.111	98.114.205.102	74	90	2	2009-04-20 06:28:34	1080	2152	4
90	54	00:08:e2:3b:56:01	00:30:48:62:4e:4a	TCP	1080 > 2152 [ACK] Seq=1 Ack=10241 Win=30660 Len=0		98.114.205.102	192.150.11.111	54	91	2	2009-04-20 06:28:34	2152	1080	4
91	1514	00:30:48:62:4e:4a	00:08:e2:3b:56:01	SOCKS	Unknown		192.150.11.111	98.114.205.102	1514	92	2	2009-04-20 06:28:34	1080	2152	4
92	54	00:08:e2:3b:56:01	00:30:48:62:4e:4a	TCP	1080 > 2152 [ACK] Seq=1 Ack=11701 Win=33580 Len=0		98.114.205.102	192.150.11.111	54	93	2	2009-04-20 06:28:34	2152	1080	4
93	642	00:30:48:62:4e:4a	00:08:e2:3b:56:01	SOCKS	Unknown		192.150.11.111	98.114.205.102	642	94	2	2009-04-20 06:28:34	1080	2152	4
94	54	00:08:e2:3b:56:01	00:30:48:62:4e:4a	TCP	1080 > 2152 [ACK] Seq=1 Ack=12289 Win=36500 Len=0		98.114.205.102	192.150.11.111	54	95	2	2009-04-20 06:28:34	2152	1080	4
95	1078	00:30:48:62:4e:4a	00:08:e2:3b:56:01	SOCKS	Unknown		192.150.11.111	98.114.205.102	1078	96	2	2009-04-20 06:28:35	1080	2152	4
96	54	00:08:e2:3b:56:01	00:30:48:62:4e:4a	TCP	1080 > 2152 [ACK] Seq=1 Ack=13313 Win=39420 Len=0		98.114.205.102	192.150.11.111	54	97	2	2009-04-20 06:28:35	2152	1080	4
97	1514	00:30:48:62:4e:4a	00:08:e2:3b:56:01	SOCKS	Unknown		192.150.11.111	98.114.205.102	1514	98	2	2009-04-20 06:28:35	1080	2152	4
98	54	00:08:e2:3b:56:01	00:30:48:62:4e:4a	TCP	1080 > 2152 [ACK] Seq=1 Ack=14773 Win=42340 Len=0		98.114.205.102	192.150.11.111	54	99	2	2009-04-20 06:28:35	2152	1080	4
99	642	00:30:48:62:4e:4a	00:08:e2:3b:56:01	SOCKS	Unknown		192.150.11.111	98.114.205.102	642	100	2	2009-04-20 06:28:35	1080	2152	4
100	54	00:08:e2:3b:56:01	00:30:48:62:4e:4a	TCP	1080 > 2152 [ACK] Seq=1 Ack=15361 Win=45260 Len=0		98.114.205.102	192.150.11.111	54	101	2	2009-04-20 06:28:35	2152	1080	4
101	1078	00:30:48:62:4e:4a	00:08:e2:3b:56:01	SOCKS	Unknown		192.150.11.111	98.114.205.102	1078	102	2	2009-04-20 06:28:35	1080	2152	4
102	54	00:08:e2:3b:56:01	00:30:48:62:4e:4a	TCP	1080 > 2152 [ACK] Seq=1 Ack=16385 Win=48180 Len=0		98.114.205.102	192.150.11.111	54	103	2	2009-04-20 06:28:35	2152	1080	4
103	1514	00:30:48:62:4e:4a	00:08:e2:3b:56:01	SOCKS	Unknown		192.150.11.111	98.114.205.102	1514	104	2	2009-04-20 06:28:35	1080	2152	4
104	54	00:08:e2:3b:56:01	00:30:48:62:4e:4a	TCP	1080 > 2152 [ACK] Seq=1 Ack=17845 Win=51100 Len=0		98.114.205.102	192.150.11.111	54	105	2	2009-04-20 06:28:35	2152	1080	4
105	642	00:30:48:62:4e:4a	00:08:e2:3b:56:01	SOCKS	Unknown		192.150.11.111	98.114.205.102	642	106	2	2009-04-20 06:28:35	1080	2152	4
106	54	00:08:e2:3b:56:01	00:30:48:62:4e:4a	TCP	1080 > 2152 [ACK] Seq=1 Ack=18433 Win=54020 Len=0		98.114.205.102	192.150.11.111	54	107	2	2009-04-20 06:28:35	2152	1080	4
107	1514	00:30:48:62:4e:4a	00:08:e2:3b:56:01	SOCKS	Unknown		192.150.11.111	98.114.205.102	1514	108	2	2009-04-20 06:28:35	1080	2152	4
108	54	00:08:e2:3b:56:01	00:30:48:62:4e:4a	TCP	1080 > 2152 [ACK] Seq=1 Ack=19893 Win=56940 Len=0		98.114.205.102	192.150.11.111	54	109	2	2009-04-20 06:28:35	2152	1080	4
109	642	00:30:48:62:4e:4a	00:08:e2:3b:56:01	SOCKS	Unknown		192.150.11.111	98.114.205.102	642	110	2	2009-04-20 06:28:35	1080	2152	4
110	54	00:08:e2:3b:56:01	00:30:48:62:4e:4a	TCP	1080 > 2152 [ACK] Seq=1 Ack=20481 Win=59860 Len=0		98.114.205.102	192.150.11.111	54	111	2	2009-04-20 06:28:35	2152	1080	4
111	1078	00:30:48:62:4e:4a	00:08:e2:3b:56:01	SOCKS	Unknown		192.150.11.111	98.114.205.102	1078	112	2	2009-04-20 06:28:35	1080	2152	4
112	54	00:08:e2:3b:56:01	00:30:48:62:4e:4a	TCP	1080 > 2152 [ACK] Seq=1 Ack=21505 Win=62780 Len=0		98.114.205.102	192.150.11.111	54	113	2	2009-04-20 06:28:35	2152	1080	4
113	1514	00:30:48:62:4e:4a	00:08:e2:3b:56:01	SOCKS	Unknown		192.150.11.111	98.114.205.102	1514	114	2	2009-04-20 06:28:35	1080	2152	4
114	54	00:08:e2:3b:56:01	00:30:48:62:4e:4a	TCP	1080 > 2152 [ACK] Seq=1 Ack=22965 Win=62780 Len=0		98.114.205.102	192.150.11.111	54	115	2	2009-04-20 06:28:35	2152	1080	4
115	642	00:30:48:62:4e:4a	00:08:e2:3b:56:01	SOCKS	Unknown		192.150.11.111	98.114.205.102	642	116	2	2009-04-20 06:28:35	1080	2152	4
116	54	00:08:e2:3b:56:01	00:30:48:62:4e:4a	TCP	1080 > 2152 [ACK] Seq=1 Ack=23553 Win=62780 Len=0		98.114.205.102	192.150.11.111	54	117	2	2009-04-20 06:28:35	2152	1080	4
117	1078	00:30:48:62:4e:4a	00:08:e2:3b:56:01	SOCKS	Unknown		192.150.11.111	98.114.205.102	1078	118	2	2009-04-20 06:28:35	1080	2152	4
118	54	00:08:e2:3b:56:01	00:30:48:62:4e:4a	TCP	1080 > 2152 [ACK] Seq=1 Ack=24577 Win=62780 Len=0		98.114.205.102	192.150.11.111	54	119	2	2009-04-20 06:28:35	2152	1080	4
119	1078	00:30:48:62:4e:4a	00:08:e2:3b:56:01	SOCKS	Unknown		192.150.11.111	98.114.205.102	1078	120	2	2009-04-20 06:28:35	1080	2152	4
120	54	00:08:e2:3b:56:01	00:30:48:62:4e:4a	TCP	1080 > 2152 [ACK] Seq=1 Ack=25601 Win=63488 Len=0		98.114.205.102	192.150.11.111	54	121	2	2009-04-20 06:28:35	2152	1080	4
121	1514	00:30:48:62:4e:4a	00:08:e2:3b:56:01	SOCKS	Unknown		192.150.11.111	98.114.205.102	1514	122	2	2009-04-20 06:28:35	1080	2152	4
122	642	00:30:48:62:4e:4a	00:08:e2:3b:56:01	SOCKS	Unknown		192.150.11.111	98.114.205.102	642	123	2	2009-04-20 06:28:35	1080	2152	4
123	54	00:08:e2:3b:56:01	00:30:48:62:4e:4a	TCP	1080 > 2152 [ACK] Seq=1 Ack=27649 Win=63488 Len=0		98.114.205.102	192.150.11.111	54	124	2	2009-04-20 06:28:35	2152	1080	4
124	1078	00:30:48:62:4e:4a	00:08:e2:3b:56:01	SOCKS	Unknown		192.150.11.111	98.114.205.102	1078	125	2	2009-04-20 06:28:36	1080	2152	4
125	54	00:08:e2:3b:56:01	00:30:48:62:4e:4a	TCP	1080 > 2152 [ACK] Seq=1 Ack=28673 Win=63488 Len=0		98.114.205.102	192.150.11.111	54	126	2	2009-04-20 06:28:36	2152	1080	4
126	1514	00:30:48:62:4e:4a	00:08:e2:3b:56:01	SOCKS	Unknown		192.150.11.111	98.114.205.102	1514	127	2	2009-04-20 06:28:36	1080	2152	4
127	642	00:30:48:62:4e:4a	00:08:e2:3b:56:01	SOCKS	Unknown		192.150.11.111	98.114.205.102	642	128	2	2009-04-20 06:28:36	1080	2152	4
128	54	00:08:e2:3b:56:01	00:30:48:62:4e:4a	TCP	1080 > 2152 [ACK] Seq=1 Ack=30721 Win=63488 Len=0		98.114.205.102	192.150.11.111	54	129	2	2009-04-20 06:28:36	2152	1080	4
129	1078	00:30:48:62:4e:4a	00:08:e2:3b:56:01	SOCKS	Unknown		192.150.11.111	98.114.205.102	1078	130	2	2009-04-20 06:28:36	1080	2152	4
130	54	00:08:e2:3b:56:01	00:30:48:62:4e:4a	TCP	1080 > 2152 [ACK] Seq=1 Ack=31745 Win=63488 Len=0		98.114.205.102	192.150.11.111	54	131	2	2009-04-20 06:28:36	2152	1080	4
131	1078	00:30:48:62:4e:4a	00:08:e2:3b:56:01	SOCKS	Unknown		192.150.11.111	98.114.205.102	1078	132	2	2009-04-20 06:28:36	1080	2152	4
132	1514	00:30:48:62:4e:4a	00:08:e2:3b:56:01	SOCKS	Unknown		192.150.11.111	98.114.205.102	1514	133	2	2009-04-20 06:28:36	1080	2152	4
133	54	00:08:e2:3b:56:01	00:30:48:62:4e:4a	TCP	1080 > 2152 [ACK] Seq=1 Ack=34229 Win=63488 Len=0		98.114.205.102	192.150.11.111	54	134	2	2009-04-20 06:28:36	2152	1080	4
134	642	00:30:48:62:4e:4a	00:08:e2:3b:56:01	SOCKS	Unknown		192.150.11.111	98.114.205.102	642	135	2	2009-04-20 06:28:36	1080	2152	4
135	54	00:08:e2:3b:56:01	00:30:48:62:4e:4a	TCP	1080 > 2152 [ACK] Seq=1 Ack=34817 Win=63488 Len=0		98.114.205.102	192.150.11.111	54	136	2	2009-04-20 06:28:36	2152	1080	4
136	1514	00:30:48:62:4e:4a	00:08:e2:3b:56:01	SOCKS	Unknown		192.150.11.111	98.114.205.102	1514	137	2	2009-04-20 06:28:36	1080	2152	4
137	642	00:30:48:62:4e:4a	00:08:e2:3b:56:01	SOCKS	Unknown		192.150.11.111	98.114.205.102	642	138	2	2009-04-20 06:28:36	1080	2152	4
138	54	00:08:e2:3b:56:01	00:30:48:62:4e:4a	TCP	1080 > 2152 [ACK] Seq=1 Ack=36865 Win=63488 Len=0		98.114.205.102	192.150.11.111	54	139	2	2009-04-20 06:28:36	2152	1080	4
139	1078	00:30:48:62:4e:4a	00:08:e2:3b:56:01	SOCKS	Unknown		192.150.11.111	98.114.205.102	1078	140	2	2009-04-20 06:28:36	1080	2152	4
140	54	00:08:e2:3b:56:01	00:30:48:62:4e:4a	TCP	1080 > 2152 [ACK] Seq=1 Ack=37889 Win=63488 Len=0		98.114.205.102	192.150.11.111	54	141	2	2009-04-20 06:28:36	2152	1080	4
141	1514	00:30:48:62:4e:4a	00:08:e2:3b:56:01	SOCKS	Unknown		192.150.11.111	98.114.205.102	1514	142	2	2009-04-20 06:28:36	1080	2152	4
142	642	00:30:48:62:4e:4a	00:08:e2:3b:56:01	SOCKS	Unknown		192.150.11.111	98.114.205.102	642	143	2	2009-04-20 06:28:36	1080	2152	4
143	54	00:08:e2:3b:56:01	00:30:48:62:4e:4a	TCP	1080 > 2152 [ACK] Seq=1 Ack=39937 Win=63488 Len=0		98.114.205.102	192.150.11.111	54	144	2	2009-04-20 06:28:36	2152	1080	4
144	1514	00:30:48:62:4e:4a	00:08:e2:3b:56:01	SOCKS	Unknown		192.150.11.111	98.114.205.102	1514	145	2	2009-04-20 06:28:36	1080	2152	4
145	642	00:30:48:62:4e:4a	00:08:e2:3b:56:01	SOCKS	Unknown		192.150.11.111	98.114.205.102	642	146	2	2009-04-20 06:28:36	1080	2152	4
146	54	00:08:e2:3b:56:01	00:30:48:62:4e:4a	TCP	1080 > 2152 [ACK] Seq=1 Ack=41985 Win=63488 Len=0		98.114.205.102	192.150.11.111	54	147	2	2009-04-20 06:28:36	2152	1080	4
147	1078	00:30:48:62:4e:4a	00:08:e2:3b:56:01	SOCKS	Unknown		192.150.11.111	98.114.205.102	1078	148	2	2009-04-20 06:28:36	1080	2152	4
148	54	00:08:e2:3b:56:01	00:30:48:62:4e:4a	TCP	1080 > 2152 [ACK] Seq=1 Ack=43009 Win=63488 Len=0		98.114.205.102	192.150.11.111	54	149	2	2009-04-20 06:28:36	2152	1080	4
149	1078	00:30:48:62:4e:4a	00:08:e2:3b:56:01	SOCKS	Unknown		192.150.11.111	98.114.205.102	1078	150	2	2009-04-20 06:28:37	1080	2152	4
150	54	00:08:e2:3b:56:01	00:30:48:62:4e:4a	TCP	1080 > 2152 [ACK] Seq=1 Ack=44033 Win=63488 Len=0		98.114.205.102	192.150.11.111	54	151	2	2009-04-20 06:28:37	2152	1080	4
151	1514	00:30:48:62:4e:4a	00:08:e2:3b:56:01	SOCKS	Unknown		192.150.11.111	98.114.205.102	1514	152	2	2009-04-20 06:28:37	1080	2152	4
152	642	00:30:48:62:4e:4a	00:08:e2:3b:56:01	SOCKS	Unknown		192.150.11.111	98.114.205.102	642	153	2	2009-04-20 06:28:37	1080	2152	4
153	54	00:08:e2:3b:56:01	00:30:48:62:4e:4a	TCP	1080 > 2152 [ACK] Seq=1 Ack=46081 Win=63488 Len=0		98.114.205.102	192.150.11.111	54	154	2	2009-04-20 06:28:37	2152	1080	4
154	1514	00:30:48:62:4e:4a	00:08:e2:3b:56:01	SOCKS	Unknown		192.150.11.111	98.114.205.102	1514	155	2	2009-04-20 06:28:37	1080	2152	4
155	642	00:30:48:62:4e:4a	00:08:e2:3b:56:01	SOCKS	Unknown		192.150.11.111	98.114.205.102	642	156	2	2009-04-20 06:28:37	1080	2152	4
156	54	00:08:e2:3b:56:01	00:30:48:62:4e:4a	TCP	1080 > 2152 [ACK] Seq=1 Ack=48129 Win=63488 Len=0		98.114.205.102	192.150.11.111	54	157	2	2009-04-20 06:28:37	2152	1080	4
157	1078	00:30:48:62:4e:4a	00:08:e2:3b:56:01	SOCKS	Unknown		192.150.11.111	98.114.205.102	1078	158	2	2009-04-20 06:28:37	1080	2152	4
158	54	00:08:e2:3b:56:01	00:30:48:62:4e:4a	TCP	1080 > 2152 [ACK] Seq=1 Ack=49153 Win=63488 Len=0		98.114.205.102	192.150.11.111	54	159	2	2009-04-20 06:28:37	2152	1080	4
159	1514	00:30:48:62:4e:4a	00:08:e2:3b:56:01	SOCKS	Unknown		192.150.11.111	98.114.205.102	1514	160	2	2009-04-20 06:28:37	1080	2152	4
160	642	00:30:48:62:4e:4a	00:08:e2:3b:56:01	SOCKS	Unknown		192.150.11.111	98.114.205.102	642	161	2	2009-04-20 06:28:37	1080	2152	4
161	54	00:08:e2:3b:56:01	00:30:48:62:4e:4a	TCP	1080 > 2152 [ACK] Seq=1 Ack=51201 Win=63488 Len=0		98.114.205.102	192.150.11.111	54	162	2	2009-04-20 06:28:37	2152	1080	4
162	1078	00:30:48:62:4e:4a	00:08:e2:3b:56:01	SOCKS	Unknown		192.150.11.111	98.114.205.102	1078	163	2	2009-04-20 06:28:37	1080	2152	4
163	54	00:08:e2:3b:56:01	00:30:48:62:4e:4a	TCP	1080 > 2152 [ACK] Seq=1 Ack=52225 Win=63488 Len=0		98.114.205.102	192.150.11.111	54	164	2	2009-04-20 06:28:37	2152	1080	4
164	1514	00:30:48:62:4e:4a	00:08:e2:3b:56:01	SOCKS	Unknown		192.150.11.111	98.114.205.102	1514	165	2	2009-04-20 06:28:37	1080	2152	4
165	642	00:30:48:62:4e:4a	00:08:e2:3b:56:01	SOCKS	Unknown		192.150.11.111	98.114.205.102	642	166	2	2009-04-20 06:28:37	1080	2152	4
166	54	00:08:e2:3b:56:01	00:30:48:62:4e:4a	TCP	1080 > 2152 [ACK] Seq=1 Ack=54273 Win=63488 Len=0		98.114.205.102	192.150.11.111	54	167	2	2009-04-20 06:28:37	2152	1080	4
167	1078	00:30:48:62:4e:4a	00:08:e2:3b:56:01	SOCKS	Unknown		192.150.11.111	98.114.205.102	1078	168	2	2009-04-20 06:28:37	1080	2152	4
168	54	00:08:e2:3b:56:01	00:30:48:62:4e:4a	TCP	1080 > 2152 [ACK] Seq=1 Ack=55297 Win=63488 Len=0		98.114.205.102	192.150.11.111	54	169	2	2009-04-20 06:28:37	2152	1080	4
169	1078	00:30:48:62:4e:4a	00:08:e2:3b:56:01	SOCKS	Unknown		192.150.11.111	98.114.205.102	1078	170	2	2009-04-20 06:28:37	1080	2152	4
170	54	00:08:e2:3b:56:01	00:30:48:62:4e:4a	TCP	1080 > 2152 [ACK] Seq=1 Ack=56321 Win=63488 Len=0		98.114.205.102	192.150.11.111	54	171	2	2009-04-20 06:28:37	2152	1080	4
171	1514	00:30:48:62:4e:4a	00:08:e2:3b:56:01	SOCKS	Unknown		192.150.11.111	98.114.205.102	1514	172	2	2009-04-20 06:28:37	1080	2152	4
172	642	00:30:48:62:4e:4a	00:08:e2:3b:56:01	SOCKS	Unknown		192.150.11.111	98.114.205.102	642	173	2	2009-04-20 06:28:37	1080	2152	4
173	54	00:08:e2:3b:56:01	00:30:48:62:4e:4a	TCP	1080 > 2152 [ACK] Seq=1 Ack=58369 Win=63488 Len=0		98.114.205.102	192.150.11.111	54	174	2	2009-04-20 06:28:37	2152	1080	4
174	1514	00:30:48:62:4e:4a	00:08:e2:3b:56:01	SOCKS	Unknown		192.150.11.111	98.114.205.102	1514	175	2	2009-04-20 06:28:38	1080	2152	4
175	642	00:30:48:62:4e:4a	00:08:e2:3b:56:01	SOCKS	Unknown		192.150.11.111	98.114.205.102	642	176	2	2009-04-20 06:28:38	1080	2152	4
176	54	00:08:e2:3b:56:01	00:30:48:62:4e:4a	TCP	1080 > 2152 [ACK] Seq=1 Ack=60417 Win=63488 Len=0		98.114.205.102	192.150.11.111	54	177	2	2009-04-20 06:28:38	2152	1080	4
177	1078	00:30:48:62:4e:4a	00:08:e2:3b:56:01	SOCKS	Unknown		192.150.11.111	98.114.205.102	1078	178	2	2009-04-20 06:28:38	1080	2152	4
178	54	00:08:e2:3b:56:01	00:30:48:62:4e:4a	TCP	1080 > 2152 [ACK] Seq=1 Ack=61441 Win=63488 Len=0		98.114.205.102	192.150.11.111	54	179	2	2009-04-20 06:28:38	2152	1080	4
179	1514	00:30:48:62:4e:4a	00:08:e2:3b:56:01	SOCKS	Unknown		192.150.11.111	98.114.205.102	1514	180	2	2009-04-20 06:28:38	1080	2152	4
180	642	00:30:48:62:4e:4a	00:08:e2:3b:56:01	SOCKS	Unknown		192.150.11.111	98.114.205.102	642	181	2	2009-04-20 06:28:38	1080	2152	4
181	54	00:08:e2:3b:56:01	00:30:48:62:4e:4a	TCP	1080 > 2152 [ACK] Seq=1 Ack=63489 Win=63488 Len=0		98.114.205.102	192.150.11.111	54	182	2	2009-04-20 06:28:38	2152	1080	4
182	1514	00:30:48:62:4e:4a	00:08:e2:3b:56:01	SOCKS	Unknown		192.150.11.111	98.114.205.102	1514	183	2	2009-04-20 06:28:38	1080	2152	4
183	642	00:30:48:62:4e:4a	00:08:e2:3b:56:01	SOCKS	Unknown		192.150.11.111	98.114.205.102	642	184	2	2009-04-20 06:28:38	1080	2152	4
184	54	00:08:e2:3b:56:01	00:30:48:62:4e:4a	TCP	1080 > 2152 [ACK] Seq=1 Ack=65537 Win=63488 Len=0		98.114.205.102	192.150.11.111	54	185	2	2009-04-20 06:28:38	2152	1080	4
185	1514	00:30:48:62:4e:4a	00:08:e2:3b:56:01	SOCKS	Unknown		192.150.11.111	98.114.205.102	1514	186	2	2009-04-20 06:28:38	1080	2152	4
186	642	00:30:48:62:4e:4a	00:08:e2:3b:56:01	SOCKS	Unknown		192.150.11.111	98.114.205.102	642	187	2	2009-04-20 06:28:38	1080	2152	4
187	54	00:08:e2:3b:56:01	00:30:48:62:4e:4a	TCP	1080 > 2152 [ACK] Seq=1 Ack=67585 Win=63488 Len=0		98.114.205.102	192.150.11.111	54	188	2	2009-04-20 06:28:38	2152	1080	4
188	1078	00:30:48:62:4e:4a	00:08:e2:3b:56:01	SOCKS	Unknown		192.150.11.111	98.114.205.102	1078	189	2	2009-04-20 06:28:38	1080	2152	4
189	54	00:08:e2:3b:56:01	00:30:48:62:4e:4a	TCP	1080 > 2152 [ACK] Seq=1 Ack=68609 Win=63488 Len=0		98.114.205.102	192.150.11.111	54	190	2	2009-04-20 06:28:38	2152	1080	4
190	1514	00:30:48:62:4e:4a	00:08:e2:3b:56:01	SOCKS	Unknown		192.150.11.111	98.114.205.102	1514	191	2	2009-04-20 06:28:38	1080	2152	4
191	642	00:30:48:62:4e:4a	00:08:e2:3b:56:01	SOCKS	Unknown		192.150.11.111	98.114.205.102	642	192	2	2009-04-20 06:28:38	1080	2152	4
192	54	00:08:e2:3b:56:01	00:30:48:62:4e:4a	TCP	1080 > 2152 [ACK] Seq=1 Ack=70657 Win=63488 Len=0		98.114.205.102	192.150.11.111	54	193	2	2009-04-20 06:28:38	2152	1080	4
193	1078	00:30:48:62:4e:4a	00:08:e2:3b:56:01	SOCKS	Unknown		192.150.11.111	98.114.205.102	1078	194	2	2009-04-20 06:28:38	1080	2152	4
194	54	00:08:e2:3b:56:01	00:30:48:62:4e:4a	TCP	1080 > 2152 [ACK] Seq=1 Ack=71681 Win=63488 Len=0		98.114.205.102	192.150.11.111	54	195	2	2009-04-20 06:28:38	2152	1080	4
195	1078	00:30:48:62:4e:4a	00:08:e2:3b:56:01	SOCKS	Unknown		192.150.11.111	98.114.205.102	1078	196	2	2009-04-20 06:28:38	1080	2152	4
196	54	00:08:e2:3b:56:01	00:30:48:62:4e:4a	TCP	1080 > 2152 [ACK] Seq=1 Ack=72705 Win=63488 Len=0		98.114.205.102	192.150.11.111	54	197	2	2009-04-20 06:28:38	2152	1080	4
197	1514	00:30:48:62:4e:4a	00:08:e2:3b:56:01	SOCKS	Unknown		192.150.11.111	98.114.205.102	1514	198	2	2009-04-20 06:28:38	1080	2152	4
198	642	00:30:48:62:4e:4a	00:08:e2:3b:56:01	SOCKS	Unknown		192.150.11.111	98.114.205.102	642	199	2	2009-04-20 06:28:38	1080	2152	4
199	54	00:08:e2:3b:56:01	00:30:48:62:4e:4a	TCP	1080 > 2152 [ACK] Seq=1 Ack=74753 Win=63488 Len=0		98.114.205.102	192.150.11.111	54	200	2	2009-04-20 06:28:38	2152	1080	4
200	1078	00:30:48:62:4e:4a	00:08:e2:3b:56:01	SOCKS	Unknown		192.150.11.111	98.114.205.102	1078	201	2	2009-04-20 06:28:39	1080	2152	4
201	54	00:08:e2:3b:56:01	00:30:48:62:4e:4a	TCP	1080 > 2152 [ACK] Seq=1 Ack=75777 Win=63488 Len=0		98.114.205.102	192.150.11.111	54	202	2	2009-04-20 06:28:39	2152	1080	4
202	1514	00:30:48:62:4e:4a	00:08:e2:3b:56:01	SOCKS	Unknown		192.150.11.111	98.114.205.102	1514	203	2	2009-04-20 06:28:39	1080	2152	4
203	642	00:30:48:62:4e:4a	00:08:e2:3b:56:01	SOCKS	Unknown		192.150.11.111	98.114.205.102	642	204	2	2009-04-20 06:28:39	1080	2152	4
204	54	00:08:e2:3b:56:01	00:30:48:62:4e:4a	TCP	1080 > 2152 [ACK] Seq=1 Ack=77825 Win=63488 Len=0		98.114.205.102	192.150.11.111	54	205	2	2009-04-20 06:28:39	2152	1080	4
205	1078	00:30:48:62:4e:4a	00:08:e2:3b:56:01	SOCKS	Unknown		192.150.11.111	98.114.205.102	1078	206	2	2009-04-20 06:28:39	1080	2152	4
206	54	00:08:e2:3b:56:01	00:30:48:62:4e:4a	TCP	1080 > 2152 [ACK] Seq=1 Ack=78849 Win=63488 Len=0		98.114.205.102	192.150.11.111	54	207	2	2009-04-20 06:28:39	2152	1080	4
207	1514	00:30:48:62:4e:4a	00:08:e2:3b:56:01	SOCKS	Unknown		192.150.11.111	98.114.205.102	1514	208	2	2009-04-20 06:28:39	1080	2152	4
208	642	00:30:48:62:4e:4a	00:08:e2:3b:56:01	SOCKS	Unknown		192.150.11.111	98.114.205.102	642	209	2	2009-04-20 06:28:39	1080	2152	4
209	54	00:08:e2:3b:56:01	00:30:48:62:4e:4a	TCP	1080 > 2152 [ACK] Seq=1 Ack=80897 Win=63488 Len=0		98.114.205.102	192.150.11.111	54	210	2	2009-04-20 06:28:39	2152	1080	4
210	1078	00:30:48:62:4e:4a	00:08:e2:3b:56:01	SOCKS	Unknown		192.150.11.111	98.114.205.102	1078	211	2	2009-04-20 06:28:39	1080	2152	4
211	54	00:08:e2:3b:56:01	00:30:48:62:4e:4a	TCP	1080 > 2152 [ACK] Seq=1 Ack=81921 Win=63488 Len=0		98.114.205.102	192.150.11.111	54	212	2	2009-04-20 06:28:39	2152	1080	4
212	1514	00:30:48:62:4e:4a	00:08:e2:3b:56:01	SOCKS	Unknown		192.150.11.111	98.114.205.102	1514	213	2	2009-04-20 06:28:39	1080	2152	4
213	642	00:30:48:62:4e:4a	00:08:e2:3b:56:01	SOCKS	Unknown		192.150.11.111	98.114.205.102	642	214	2	2009-04-20 06:28:39	1080	2152	4
214	54	00:08:e2:3b:56:01	00:30:48:62:4e:4a	TCP	1080 > 2152 [ACK] Seq=1 Ack=83969 Win=63488 Len=0		98.114.205.102	192.150.11.111	54	215	2	2009-04-20 06:28:39	2152	1080	4
215	1514	00:30:48:62:4e:4a	00:08:e2:3b:56:01	SOCKS	Unknown		192.150.11.111	98.114.205.102	1514	216	2	2009-04-20 06:28:39	1080	2152	4
216	642	00:30:48:62:4e:4a	00:08:e2:3b:56:01	SOCKS	Unknown		192.150.11.111	98.114.205.102	642	217	2	2009-04-20 06:28:39	1080	2152	4
217	54	00:08:e2:3b:56:01	00:30:48:62:4e:4a	TCP	1080 > 2152 [ACK] Seq=1 Ack=86017 Win=63488 Len=0		98.114.205.102	192.150.11.111	54	218	2	2009-04-20 06:28:39	2152	1080	4
218	1078	00:30:48:62:4e:4a	00:08:e2:3b:56:01	SOCKS	Unknown		192.150.11.111	98.114.205.102	1078	219	2	2009-04-20 06:28:39	1080	2152	4
219	54	00:08:e2:3b:56:01	00:30:48:62:4e:4a	TCP	1080 > 2152 [ACK] Seq=1 Ack=87041 Win=63488 Len=0		98.114.205.102	192.150.11.111	54	220	2	2009-04-20 06:28:39	2152	1080	4
220	1514	00:30:48:62:4e:4a	00:08:e2:3b:56:01	SOCKS	Unknown		192.150.11.111	98.114.205.102	1514	221	2	2009-04-20 06:28:39	1080	2152	4
221	642	00:30:48:62:4e:4a	00:08:e2:3b:56:01	SOCKS	Unknown		192.150.11.111	98.114.205.102	642	222	2	2009-04-20 06:28:39	1080	2152	4
222	54	00:08:e2:3b:56:01	00:30:48:62:4e:4a	TCP	1080 > 2152 [ACK] Seq=1 Ack=89089 Win=63488 Len=0		98.114.205.102	192.150.11.111	54	223	2	2009-04-20 06:28:39	2152	1080	4
223	1078	00:30:48:62:4e:4a	00:08:e2:3b:56:01	SOCKS	Unknown		192.150.11.111	98.114.205.102	1078	224	2	2009-04-20 06:28:40	1080	2152	4
224	54	00:08:e2:3b:56:01	00:30:48:62:4e:4a	TCP	1080 > 2152 [ACK] Seq=1 Ack=90113 Win=63488 Len=0		98.114.205.102	192.150.11.111	54	225	2	2009-04-20 06:28:40	2152	1080	4
225	1514	00:30:48:62:4e:4a	00:08:e2:3b:56:01	SOCKS	Unknown		192.150.11.111	98.114.205.102	1514	226	2	2009-04-20 06:28:40	1080	2152	4
226	642	00:30:48:62:4e:4a	00:08:e2:3b:56:01	SOCKS	Unknown		192.150.11.111	98.114.205.102	642	227	2	2009-04-20 06:28:40	1080	2152	4
227	54	00:08:e2:3b:56:01	00:30:48:62:4e:4a	TCP	1080 > 2152 [ACK] Seq=1 Ack=92161 Win=63488 Len=0		98.114.205.102	192.150.11.111	54	228	2	2009-04-20 06:28:40	2152	1080	4
228	1514	00:30:48:62:4e:4a	00:08:e2:3b:56:01	SOCKS	Unknown		192.150.11.111	98.114.205.102	1514	229	2	2009-04-20 06:28:40	1080	2152	4
229	642	00:30:48:62:4e:4a	00:08:e2:3b:56:01	SOCKS	Unknown		192.150.11.111	98.114.205.102	642	230	2	2009-04-20 06:28:40	1080	2152	4
230	54	00:08:e2:3b:56:01	00:30:48:62:4e:4a	TCP	1080 > 2152 [ACK] Seq=1 Ack=94209 Win=63488 Len=0		98.114.205.102	192.150.11.111	54	231	2	2009-04-20 06:28:40	2152	1080	4
231	1514	00:30:48:62:4e:4a	00:08:e2:3b:56:01	SOCKS	Unknown		192.150.11.111	98.114.205.102	1514	232	2	2009-04-20 06:28:40	1080	2152	4
232	642	00:30:48:62:4e:4a	00:08:e2:3b:56:01	SOCKS	Unknown		192.150.11.111	98.114.205.102	642	233	2	2009-04-20 06:28:40	1080	2152	4
233	54	00:08:e2:3b:56:01	00:30:48:62:4e:4a	TCP	1080 > 2152 [ACK] Seq=1 Ack=96257 Win=63488 Len=0		98.114.205.102	192.150.11.111	54	234	2	2009-04-20 06:28:40	2152	1080	4
234	1514	00:30:48:62:4e:4a	00:08:e2:3b:56:01	SOCKS	Unknown		192.150.11.111	98.114.205.102	1514	235	2	2009-04-20 06:28:40	1080	2152	4
235	642	00:30:48:62:4e:4a	00:08:e2:3b:56:01	SOCKS	Unknown		192.150.11.111	98.114.205.102	642	236	2	2009-04-20 06:28:40	1080	2152	4
236	54	00:08:e2:3b:56:01	00:30:48:62:4e:4a	TCP	1080 > 2152 [ACK] Seq=1 Ack=98305 Win=63488 Len=0		98.114.205.102	192.150.11.111	54	237	2	2009-04-20 06:28:40	2152	1080	4
237	1078	00:30:48:62:4e:4a	00:08:e2:3b:56:01	SOCKS	Unknown		192.150.11.111	98.114.205.102	1078	238	2	2009-04-20 06:28:40	1080	2152	4
238	54	00:08:e2:3b:56:01	00:30:48:62:4e:4a	TCP	1080 > 2152 [ACK] Seq=1 Ack=99329 Win=63488 Len=0		98.114.205.102	192.150.11.111	54	239	2	2009-04-20 06:28:40	2152	1080	4
239	1078	00:30:48:62:4e:4a	00:08:e2:3b:56:01	SOCKS	Unknown		192.150.11.111	98.114.205.102	1078	240	2	2009-04-20 06:28:40	1080	2152	4
240	54	00:08:e2:3b:56:01	00:30:48:62:4e:4a	TCP	1080 > 2152 [ACK] Seq=1 Ack=100353 Win=63488 Len=0		98.114.205.102	192.150.11.111	54	241	2	2009-04-20 06:28:40	2152	1080	4
241	1078	00:30:48:62:4e:4a	00:08:e2:3b:56:01	SOCKS	Unknown		192.150.11.111	98.114.205.102	1078	242	2	2009-04-20 06:28:40	1080	2152	4
242	54	00:08:e2:3b:56:01	00:30:48:62:4e:4a	TCP	1080 > 2152 [ACK] Seq=1 Ack=101377 Win=63488 Len=0		98.114.205.102	192.150.11.111	54	243	2	2009-04-20 06:28:40	2152	1080	4
243	1514	00:30:48:62:4e:4a	00:08:e2:3b:56:01	SOCKS	Unknown		192.150.11.111	98.114.205.102	1514	244	2	2009-04-20 06:28:40	1080	2152	4
244	642	00:30:48:62:4e:4a	00:08:e2:3b:56:01	SOCKS	Unknown		192.150.11.111	98.114.205.102	642	245	2	2009-04-20 06:28:40	1080	2152	4
245	54	00:08:e2:3b:56:01	00:30:48:62:4e:4a	TCP	1080 > 2152 [ACK] Seq=1 Ack=103425 Win=63488 Len=0		98.114.205.102	192.150.11.111	54	246	2	2009-04-20 06:28:40	2152	1080	4
246	1078	00:30:48:62:4e:4a	00:08:e2:3b:56:01	SOCKS	Unknown		192.150.11.111	98.114.205.102	1078	247	2	2009-04-20 06:28:40	1080	2152	4
247	54	00:08:e2:3b:56:01	00:30:48:62:4e:4a	TCP	1080 > 2152 [ACK] Seq=1 Ack=104449 Win=63488 Len=0		98.114.205.102	192.150.11.111	54	248	2	2009-04-20 06:28:40	2152	1080	4
248	1078	00:30:48:62:4e:4a	00:08:e2:3b:56:01	SOCKS	Unknown		192.150.11.111	98.114.205.102	1078	249	2	2009-04-20 06:28:41	1080	2152	4
249	1514	00:30:48:62:4e:4a	00:08:e2:3b:56:01	SOCKS	Unknown		192.150.11.111	98.114.205.102	1514	250	2	2009-04-20 06:28:41	1080	2152	4
250	54	00:08:e2:3b:56:01	00:30:48:62:4e:4a	TCP	1080 > 2152 [ACK] Seq=1 Ack=106933 Win=63488 Len=0		98.114.205.102	192.150.11.111	54	251	2	2009-04-20 06:28:41	2152	1080	4
251	642	00:30:48:62:4e:4a	00:08:e2:3b:56:01	SOCKS	Unknown		192.150.11.111	98.114.205.102	642	252	2	2009-04-20 06:28:41	1080	2152	4
252	54	00:08:e2:3b:56:01	00:30:48:62:4e:4a	TCP	1080 > 2152 [ACK] Seq=1 Ack=107521 Win=63488 Len=0		98.114.205.102	192.150.11.111	54	253	2	2009-04-20 06:28:41	2152	1080	4
253	1078	00:30:48:62:4e:4a	00:08:e2:3b:56:01	SOCKS	Unknown		192.150.11.111	98.114.205.102	1078	254	2	2009-04-20 06:28:41	1080	2152	4
254	54	00:08:e2:3b:56:01	00:30:48:62:4e:4a	TCP	1080 > 2152 [ACK] Seq=1 Ack=108545 Win=63488 Len=0		98.114.205.102	192.150.11.111	54	255	2	2009-04-20 06:28:41	2152	1080	4
255	1514	00:30:48:62:4e:4a	00:08:e2:3b:56:01	SOCKS	Unknown		192.150.11.111	98.114.205.102	1514	256	2	2009-04-20 06:28:41	1080	2152	4
256	642	00:30:48:62:4e:4a	00:08:e2:3b:56:01	SOCKS	Unknown		192.150.11.111	98.114.205.102	642	257	2	2009-04-20 06:28:41	1080	2152	4
257	54	00:08:e2:3b:56:01	00:30:48:62:4e:4a	TCP	1080 > 2152 [ACK] Seq=1 Ack=110593 Win=63488 Len=0		98.114.205.102	192.150.11.111	54	258	2	2009-04-20 06:28:41	2152	1080	4
258	1078	00:30:48:62:4e:4a	00:08:e2:3b:56:01	SOCKS	Unknown		192.150.11.111	98.114.205.102	1078	259	2	2009-04-20 06:28:41	1080	2152	4
259	54	00:08:e2:3b:56:01	00:30:48:62:4e:4a	TCP	1080 > 2152 [ACK] Seq=1 Ack=111617 Win=63488 Len=0		98.114.205.102	192.150.11.111	54	260	2	2009-04-20 06:28:41	2152	1080	4
260	1078	00:30:48:62:4e:4a	00:08:e2:3b:56:01	SOCKS	Unknown		192.150.11.111	98.114.205.102	1078	261	2	2009-04-20 06:28:41	1080	2152	4
261	54	00:08:e2:3b:56:01	00:30:48:62:4e:4a	TCP	1080 > 2152 [ACK] Seq=1 Ack=112641 Win=63488 Len=0		98.114.205.102	192.150.11.111	54	262	2	2009-04-20 06:28:41	2152	1080	4
262	1514	00:30:48:62:4e:4a	00:08:e2:3b:56:01	SOCKS	Unknown		192.150.11.111	98.114.205.102	1514	263	2	2009-04-20 06:28:41	1080	2152	4
263	642	00:30:48:62:4e:4a	00:08:e2:3b:56:01	SOCKS	Unknown		192.150.11.111	98.114.205.102	642	264	2	2009-04-20 06:28:41	1080	2152	4
264	54	00:08:e2:3b:56:01	00:30:48:62:4e:4a	TCP	1080 > 2152 [ACK] Seq=1 Ack=114689 Win=63488 Len=0		98.114.205.102	192.150.11.111	54	265	2	2009-04-20 06:28:41	2152	1080	4
265	1078	00:30:48:62:4e:4a	00:08:e2:3b:56:01	SOCKS	Unknown		192.150.11.111	98.114.205.102	1078	266	2	2009-04-20 06:28:41	1080	2152	4
266	54	00:08:e2:3b:56:01	00:30:48:62:4e:4a	TCP	1080 > 2152 [ACK] Seq=1 Ack=115713 Win=63488 Len=0		98.114.205.102	192.150.11.111	54	267	2	2009-04-20 06:28:41	2152	1080	4
267	1078	00:30:48:62:4e:4a	00:08:e2:3b:56:01	SOCKS	Unknown		192.150.11.111	98.114.205.102	1078	268	2	2009-04-20 06:28:41	1080	2152	4
268	1078	00:30:48:62:4e:4a	00:08:e2:3b:56:01	SOCKS	Unknown		192.150.11.111	98.114.205.102	1078	269	2	2009-04-20 06:28:41	1080	2152	4
269	54	00:08:e2:3b:56:01	00:30:48:62:4e:4a	TCP	1080 > 2152 [ACK] Seq=1 Ack=117761 Win=63488 Len=0		98.114.205.102	192.150.11.111	54	270	2	2009-04-20 06:28:41	2152	1080	4
270	1078	00:30:48:62:4e:4a	00:08:e2:3b:56:01	SOCKS	Unknown		192.150.11.111	98.114.205.102	1078	271	2	2009-04-20 06:28:41	1080	2152	4
271	1514	00:30:48:62:4e:4a	00:08:e2:3b:56:01	SOCKS	Unknown		192.150.11.111	98.114.205.102	1514	272	2	2009-04-20 06:28:42	1080	2152	4
272	54	00:08:e2:3b:56:01	00:30:48:62:4e:4a	TCP	1080 > 2152 [ACK] Seq=1 Ack=120245 Win=63488 Len=0		98.114.205.102	192.150.11.111	54	273	2	2009-04-20 06:28:42	2152	1080	4
273	642	00:30:48:62:4e:4a	00:08:e2:3b:56:01	SOCKS	Unknown		192.150.11.111	98.114.205.102	642	274	2	2009-04-20 06:28:42	1080	2152	4
274	54	00:08:e2:3b:56:01	00:30:48:62:4e:4a	TCP	1080 > 2152 [ACK] Seq=1 Ack=120833 Win=63488 Len=0		98.114.205.102	192.150.11.111	54	275	2	2009-04-20 06:28:42	2152	1080	4
275	1514	00:30:48:62:4e:4a	00:08:e2:3b:56:01	SOCKS	Unknown		192.150.11.111	98.114.205.102	1514	276	2	2009-04-20 06:28:42	1080	2152	4
276	642	00:30:48:62:4e:4a	00:08:e2:3b:56:01	SOCKS	Unknown		192.150.11.111	98.114.205.102	642	277	2	2009-04-20 06:28:42	1080	2152	4
277	54	00:08:e2:3b:56:01	00:30:48:62:4e:4a	TCP	1080 > 2152 [ACK] Seq=1 Ack=122881 Win=63488 Len=0		98.114.205.102	192.150.11.111	54	278	2	2009-04-20 06:28:42	2152	1080	4
278	1514	00:30:48:62:4e:4a	00:08:e2:3b:56:01	SOCKS	Unknown		192.150.11.111	98.114.205.102	1514	279	2	2009-04-20 06:28:42	1080	2152	4
279	642	00:30:48:62:4e:4a	00:08:e2:3b:56:01	SOCKS	Unknown		192.150.11.111	98.114.205.102	642	280	2	2009-04-20 06:28:42	1080	2152	4
280	54	00:08:e2:3b:56:01	00:30:48:62:4e:4a	TCP	1080 > 2152 [ACK] Seq=1 Ack=124929 Win=63488 Len=0		98.114.205.102	192.150.11.111	54	281	2	2009-04-20 06:28:42	2152	1080	4
281	1078	00:30:48:62:4e:4a	00:08:e2:3b:56:01	SOCKS	Unknown		192.150.11.111	98.114.205.102	1078	282	2	2009-04-20 06:28:42	1080	2152	4
282	54	00:08:e2:3b:56:01	00:30:48:62:4e:4a	TCP	1080 > 2152 [ACK] Seq=1 Ack=125953 Win=63488 Len=0		98.114.205.102	192.150.11.111	54	283	2	2009-04-20 06:28:42	2152	1080	4
283	1514	00:30:48:62:4e:4a	00:08:e2:3b:56:01	SOCKS	Unknown		192.150.11.111	98.114.205.102	1514	284	2	2009-04-20 06:28:42	1080	2152	4
284	642	00:30:48:62:4e:4a	00:08:e2:3b:56:01	SOCKS	Unknown		192.150.11.111	98.114.205.102	642	285	2	2009-04-20 06:28:42	1080	2152	4
285	54	00:08:e2:3b:56:01	00:30:48:62:4e:4a	TCP	1080 > 2152 [ACK] Seq=1 Ack=128001 Win=63488 Len=0		98.114.205.102	192.150.11.111	54	286	2	2009-04-20 06:28:42	2152	1080	4
286	1078	00:30:48:62:4e:4a	00:08:e2:3b:56:01	SOCKS	Unknown		192.150.11.111	98.114.205.102	1078	287	2	2009-04-20 06:28:42	1080	2152	4
287	54	00:08:e2:3b:56:01	00:30:48:62:4e:4a	TCP	1080 > 2152 [ACK] Seq=1 Ack=129025 Win=63488 Len=0		98.114.205.102	192.150.11.111	54	288	2	2009-04-20 06:28:42	2152	1080	4
288	1514	00:30:48:62:4e:4a	00:08:e2:3b:56:01	SOCKS	Unknown		192.150.11.111	98.114.205.102	1514	289	2	2009-04-20 06:28:42	1080	2152	4
289	642	00:30:48:62:4e:4a	00:08:e2:3b:56:01	SOCKS	Unknown		192.150.11.111	98.114.205.102	642	290	2	2009-04-20 06:28:42	1080	2152	4
290	54	00:08:e2:3b:56:01	00:30:48:62:4e:4a	TCP	1080 > 2152 [ACK] Seq=1 Ack=131073 Win=63488 Len=0		98.114.205.102	192.150.11.111	54	291	2	2009-04-20 06:28:42	2152	1080	4
291	1078	00:30:48:62:4e:4a	00:08:e2:3b:56:01	SOCKS	Unknown		192.150.11.111	98.114.205.102	1078	292	2	2009-04-20 06:28:42	1080	2152	4
292	54	00:08:e2:3b:56:01	00:30:48:62:4e:4a	TCP	1080 > 2152 [ACK] Seq=1 Ack=132097 Win=63488 Len=0		98.114.205.102	192.150.11.111	54	293	2	2009-04-20 06:28:42	2152	1080	4
293	1078	00:30:48:62:4e:4a	00:08:e2:3b:56:01	SOCKS	Unknown		192.150.11.111	98.114.205.102	1078	294	2	2009-04-20 06:28:42	1080	2152	4
294	54	00:08:e2:3b:56:01	00:30:48:62:4e:4a	TCP	1080 > 2152 [ACK] Seq=1 Ack=133121 Win=63488 Len=0		98.114.205.102	192.150.11.111	54	295	2	2009-04-20 06:28:42	2152	1080	4
295	1514	00:30:48:62:4e:4a	00:08:e2:3b:56:01	SOCKS	Unknown		192.150.11.111	98.114.205.102	1514	296	2	2009-04-20 06:28:42	1080	2152	4
296	642	00:30:48:62:4e:4a	00:08:e2:3b:56:01	SOCKS	Unknown		192.150.11.111	98.114.205.102	642	297	2	2009-04-20 06:28:42	1080	2152	4
297	54	00:08:e2:3b:56:01	00:30:48:62:4e:4a	TCP	1080 > 2152 [ACK] Seq=1 Ack=135169 Win=63488 Len=0		98.114.205.102	192.150.11.111	54	298	2	2009-04-20 06:28:42	2152	1080	4
298	1078	00:30:48:62:4e:4a	00:08:e2:3b:56:01	SOCKS	Unknown		192.150.11.111	98.114.205.102	1078	299	2	2009-04-20 06:28:42	1080	2152	4
299	54	00:08:e2:3b:56:01	00:30:48:62:4e:4a	TCP	1080 > 2152 [ACK] Seq=1 Ack=136193 Win=63488 Len=0		98.114.205.102	192.150.11.111	54	300	2	2009-04-20 06:28:42	2152	1080	4
300	1078	00:30:48:62:4e:4a	00:08:e2:3b:56:01	SOCKS	Unknown		192.150.11.111	98.114.205.102	1078	301	2	2009-04-20 06:28:42	1080	2152	4
301	1078	00:30:48:62:4e:4a	00:08:e2:3b:56:01	SOCKS	Unknown		192.150.11.111	98.114.205.102	1078	302	2	2009-04-20 06:28:43	1080	2152	4
302	54	00:08:e2:3b:56:01	00:30:48:62:4e:4a	TCP	1080 > 2152 [ACK] Seq=1 Ack=138241 Win=63488 Len=0		98.114.205.102	192.150.11.111	54	303	2	2009-04-20 06:28:43	2152	1080	4
303	1078	00:30:48:62:4e:4a	00:08:e2:3b:56:01	SOCKS	Unknown		192.150.11.111	98.114.205.102	1078	304	2	2009-04-20 06:28:43	1080	2152	4
304	54	00:08:e2:3b:56:01	00:30:48:62:4e:4a	TCP	1080 > 2152 [ACK] Seq=1 Ack=139265 Win=63488 Len=0		98.114.205.102	192.150.11.111	54	305	2	2009-04-20 06:28:43	2152	1080	4
305	1514	00:30:48:62:4e:4a	00:08:e2:3b:56:01	SOCKS	Unknown		192.150.11.111	98.114.205.102	1514	306	2	2009-04-20 06:28:43	1080	2152	4
306	642	00:30:48:62:4e:4a	00:08:e2:3b:56:01	SOCKS	Unknown		192.150.11.111	98.114.205.102	642	307	2	2009-04-20 06:28:43	1080	2152	4
307	54	00:08:e2:3b:56:01	00:30:48:62:4e:4a	TCP	1080 > 2152 [ACK] Seq=1 Ack=141313 Win=63488 Len=0		98.114.205.102	192.150.11.111	54	308	2	2009-04-20 06:28:43	2152	1080	4
308	1078	00:30:48:62:4e:4a	00:08:e2:3b:56:01	SOCKS	Unknown		192.150.11.111	98.114.205.102	1078	309	2	2009-04-20 06:28:43	1080	2152	4
309	54	00:08:e2:3b:56:01	00:30:48:62:4e:4a	TCP	1080 > 2152 [ACK] Seq=1 Ack=142337 Win=63488 Len=0		98.114.205.102	192.150.11.111	54	310	2	2009-04-20 06:28:43	2152	1080	4
310	1078	00:30:48:62:4e:4a	00:08:e2:3b:56:01	SOCKS	Unknown		192.150.11.111	98.114.205.102	1078	311	2	2009-04-20 06:28:43	1080	2152	4
311	1078	00:30:48:62:4e:4a	00:08:e2:3b:56:01	SOCKS	Unknown		192.150.11.111	98.114.205.102	1078	312	2	2009-04-20 06:28:43	1080	2152	4
312	54	00:08:e2:3b:56:01	00:30:48:62:4e:4a	TCP	1080 > 2152 [ACK] Seq=1 Ack=144385 Win=63488 Len=0		98.114.205.102	192.150.11.111	54	313	2	2009-04-20 06:28:43	2152	1080	4
313	1514	00:30:48:62:4e:4a	00:08:e2:3b:56:01	SOCKS	Unknown		192.150.11.111	98.114.205.102	1514	314	2	2009-04-20 06:28:43	1080	2152	4
314	642	00:30:48:62:4e:4a	00:08:e2:3b:56:01	SOCKS	Unknown		192.150.11.111	98.114.205.102	642	315	2	2009-04-20 06:28:43	1080	2152	4
315	54	00:08:e2:3b:56:01	00:30:48:62:4e:4a	TCP	1080 > 2152 [ACK] Seq=1 Ack=146433 Win=63488 Len=0		98.114.205.102	192.150.11.111	54	316	2	2009-04-20 06:28:43	2152	1080	4
316	1078	00:30:48:62:4e:4a	00:08:e2:3b:56:01	SOCKS	Unknown		192.150.11.111	98.114.205.102	1078	317	2	2009-04-20 06:28:43	1080	2152	4
317	54	00:08:e2:3b:56:01	00:30:48:62:4e:4a	TCP	1080 > 2152 [ACK] Seq=1 Ack=147457 Win=63488 Len=0		98.114.205.102	192.150.11.111	54	318	2	2009-04-20 06:28:43	2152	1080	4
318	1514	00:30:48:62:4e:4a	00:08:e2:3b:56:01	SOCKS	Unknown		192.150.11.111	98.114.205.102	1514	319	2	2009-04-20 06:28:43	1080	2152	4
319	642	00:30:48:62:4e:4a	00:08:e2:3b:56:01	SOCKS	Unknown		192.150.11.111	98.114.205.102	642	320	2	2009-04-20 06:28:43	1080	2152	4
320	54	00:08:e2:3b:56:01	00:30:48:62:4e:4a	TCP	1080 > 2152 [ACK] Seq=1 Ack=149505 Win=63488 Len=0		98.114.205.102	192.150.11.111	54	321	2	2009-04-20 06:28:43	2152	1080	4
321	1514	00:30:48:62:4e:4a	00:08:e2:3b:56:01	SOCKS	Unknown		192.150.11.111	98.114.205.102	1514	322	2	2009-04-20 06:28:43	1080	2152	4
322	642	00:30:48:62:4e:4a	00:08:e2:3b:56:01	SOCKS	Unknown		192.150.11.111	98.114.205.102	642	323	2	2009-04-20 06:28:43	1080	2152	4
323	54	00:08:e2:3b:56:01	00:30:48:62:4e:4a	TCP	1080 > 2152 [ACK] Seq=1 Ack=151553 Win=63488 Len=0		98.114.205.102	192.150.11.111	54	324	2	2009-04-20 06:28:43	2152	1080	4
324	1078	00:30:48:62:4e:4a	00:08:e2:3b:56:01	SOCKS	Unknown		192.150.11.111	98.114.205.102	1078	325	2	2009-04-20 06:28:43	1080	2152	4
325	54	00:08:e2:3b:56:01	00:30:48:62:4e:4a	TCP	1080 > 2152 [ACK] Seq=1 Ack=152577 Win=63488 Len=0		98.114.205.102	192.150.11.111	54	326	2	2009-04-20 06:28:43	2152	1080	4
326	1514	00:30:48:62:4e:4a	00:08:e2:3b:56:01	SOCKS	Unknown		192.150.11.111	98.114.205.102	1514	327	2	2009-04-20 06:28:44	1080	2152	4
327	642	00:30:48:62:4e:4a	00:08:e2:3b:56:01	SOCKS	Unknown		192.150.11.111	98.114.205.102	642	328	2	2009-04-20 06:28:44	1080	2152	4
328	54	00:08:e2:3b:56:01	00:30:48:62:4e:4a	TCP	1080 > 2152 [ACK] Seq=1 Ack=154625 Win=63488 Len=0		98.114.205.102	192.150.11.111	54	329	2	2009-04-20 06:28:44	2152	1080	4
329	1078	00:30:48:62:4e:4a	00:08:e2:3b:56:01	SOCKS	Unknown		192.150.11.111	98.114.205.102	1078	330	2	2009-04-20 06:28:44	1080	2152	4
330	54	00:08:e2:3b:56:01	00:30:48:62:4e:4a	TCP	1080 > 2152 [ACK] Seq=1 Ack=155649 Win=63488 Len=0		98.114.205.102	192.150.11.111	54	331	2	2009-04-20 06:28:44	2152	1080	4
331	1514	00:30:48:62:4e:4a	00:08:e2:3b:56:01	SOCKS	Unknown		192.150.11.111	98.114.205.102	1514	332	2	2009-04-20 06:28:44	1080	2152	4
332	642	00:30:48:62:4e:4a	00:08:e2:3b:56:01	SOCKS	Unknown		192.150.11.111	98.114.205.102	642	333	2	2009-04-20 06:28:44	1080	2152	4
333	54	00:08:e2:3b:56:01	00:30:48:62:4e:4a	TCP	1080 > 2152 [ACK] Seq=1 Ack=157697 Win=63488 Len=0		98.114.205.102	192.150.11.111	54	334	2	2009-04-20 06:28:44	2152	1080	4
334	1078	00:30:48:62:4e:4a	00:08:e2:3b:56:01	SOCKS	Unknown		192.150.11.111	98.114.205.102	1078	335	2	2009-04-20 06:28:44	1080	2152	4
335	54	00:08:e2:3b:56:01	00:30:48:62:4e:4a	TCP	1080 > 2152 [ACK] Seq=1 Ack=158721 Win=63488 Len=0		98.114.205.102	192.150.11.111	54	336	2	2009-04-20 06:28:44	2152	1080	4
336	60	00:30:48:62:4e:4a	00:08:e2:3b:56:01	TCP	2152 > 1080 [FIN, ACK] Seq=158721 Ack=1 Win=64240 Len=0		192.150.11.111	98.114.205.102	60	337	2	2009-04-20 06:28:44	1080	2152	4
337	54	00:08:e2:3b:56:01	00:30:48:62:4e:4a	TCP	1080 > 2152 [FIN, ACK] Seq=1 Ack=158722 Win=63488 Len=0		98.114.205.102	192.150.11.111	54	338	2	2009-04-20 06:28:44	2152	1080	4
338	72	00:08:e2:3b:56:01	00:30:48:62:4e:4a	DATA	36296 > 8884 [PSH, ACK] Seq=72 Ack=165 Win=5888 Len=6 TSval=4055636635 TSecr=438621		98.114.205.102	192.150.11.111	72	339	2	2009-04-20 06:28:44	8884	36296	3
339	89	00:30:48:62:4e:4a	00:08:e2:3b:56:01	DATA	8884 > 36296 [PSH, ACK] Seq=165 Ack=72 Win=64169 Len=23 TSval=438721 TSecr=4055634156		192.150.11.111	98.114.205.102	89	340	2	2009-04-20 06:28:44	36296	8884	3
340	66	00:08:e2:3b:56:01	00:30:48:62:4e:4a	TCP	36296 > 8884 [ACK] Seq=78 Ack=188 Win=5888 Len=0 TSval=4055636635 TSecr=438721		98.114.205.102	192.150.11.111	66	341	2	2009-04-20 06:28:44	8884	36296	3
341	66	00:08:e2:3b:56:01	00:30:48:62:4e:4a	TCP	36296 > 8884 [FIN, ACK] Seq=78 Ack=188 Win=5888 Len=0 TSval=4055636635 TSecr=438721		98.114.205.102	192.150.11.111	66	342	2	2009-04-20 06:28:44	8884	36296	3
342	60	00:30:48:62:4e:4a	00:08:e2:3b:56:01	TCP	2152 > 1080 [ACK] Seq=158722 Ack=2 Win=64240 Len=0		192.150.11.111	98.114.205.102	60	343	2	2009-04-20 06:28:44	1080	2152	4
343	66	00:30:48:62:4e:4a	00:08:e2:3b:56:01	TCP	8884 > 36296 [ACK] Seq=188 Ack=79 Win=64163 Len=0 TSval=438722 TSecr=4055636635		192.150.11.111	98.114.205.102	66	344	2	2009-04-20 06:28:44	36296	8884	3
344	93	00:30:48:62:4e:4a	00:08:e2:3b:56:01	DATA	8884 > 36296 [PSH, ACK] Seq=188 Ack=79 Win=64163 Len=27 TSval=438722 TSecr=4055636635		192.150.11.111	98.114.205.102	93	345	2	2009-04-20 06:28:44	36296	8884	3
345	54	00:08:e2:3b:56:01	00:30:48:62:4e:4a	TCP	36296 > 8884 [RST] Seq=79 Win=0 Len=0		98.114.205.102	192.150.11.111	54	346	2	2009-04-20 06:28:44	8884	36296	3
346	66	00:30:48:62:4e:4a	00:08:e2:3b:56:01	TCP	8884 > 36296 [FIN, ACK] Seq=215 Ack=79 Win=64163 Len=0 TSval=438722 TSecr=4055636635		192.150.11.111	98.114.205.102	66	347	2	2009-04-20 06:28:44	36296	8884	3
347	54	00:08:e2:3b:56:01	00:30:48:62:4e:4a	TCP	36296 > 8884 [RST] Seq=79 Win=0 Len=0		98.114.205.102	192.150.11.111	54	348	2	2009-04-20 06:28:44	8884	36296	3
