	captured_length	eth_dst	eth_src	highest_layer	info_line	interface_captured	ip_dst	ip_src	length	number	project_id	sniff_timestamp	tcp_dstport	tcp_srcport	tcp_stream
0	74	70:5a:b6:51:d7:b2	00:23:8b:82:1f:4a	TCP	46104→80 [SYN] Seq=0 Win=5840 Len=0 MSS=1460 SACK_PERM=1 TSval=3299940 TSecr=0 WS=64		10.42.42.50	10.42.42.253	74	1	4	2010-02-03 01:34:06	80.0	46104.0	0.0
1	60	00:23:8b:82:1f:4a	70:5a:b6:51:d7:b2	TCP	80 > 46104 [RST, ACK] Seq=1 Ack=1 Win=0 Len=0		10.42.42.253	10.42.42.50	60	2	4	2010-02-03 01:34:06	46104.0	80.0	0.0
2	74	00:26:22:cb:1e:79	00:23:8b:82:1f:4a	TCP	59856 > 80 [SYN] Seq=0 Win=5840 Len=0 MSS=1460 SACK_PERM=1 TSval=3300092 TSecr=0 WS=64		10.42.42.56	10.42.42.253	74	3	4	2010-02-03 01:34:07	80.0	59856.0	1.0
3	74	00:16:cb:92:6e:dc	00:23:8b:82:1f:4a	TCP	40921 > 80 [SYN] Seq=0 Win=5840 Len=0 MSS=1460 SACK_PERM=1 TSval=3300092 TSecr=0 WS=64		10.42.42.25	10.42.42.253	74	4	4	2010-02-03 01:34:07	80.0	40921.0	2.0
4	60	00:23:8b:82:1f:4a	00:26:22:cb:1e:79	TCP	80 > 59856 [RST, ACK] Seq=1 Ack=1 Win=0 Len=0		10.42.42.253	10.42.42.56	60	5	4	2010-02-03 01:34:07	59856.0	80.0	1.0
5	60	00:23:8b:82:1f:4a	00:16:cb:92:6e:dc	TCP	80 > 40921 [RST, ACK] Seq=1 Ack=1 Win=0 Len=0		10.42.42.253	10.42.42.25	60	6	4	2010-02-03 01:34:07	40921.0	80.0	2.0
6	74	70:5a:b6:51:d7:b2	00:23:8b:82:1f:4a	TCP	38232 > 554 [SYN] Seq=0 Win=5840 Len=0 MSS=1460 SACK_PERM=1 TSval=3300144 TSecr=0 WS=64		10.42.42.50	10.42.42.253	74	7	4	2010-02-03 01:34:07	554.0	38232.0	3.0
7	74	00:26:22:cb:1e:79	00:23:8b:82:1f:4a	TCP	43771 > 554 [SYN] Seq=0 Win=5840 Len=0 MSS=1460 SACK_PERM=1 TSval=3300144 TSecr=0 WS=64		10.42.42.56	10.42.42.253	74	8	4	2010-02-03 01:34:07	554.0	43771.0	4.0
8	60	00:23:8b:82:1f:4a	00:26:22:cb:1e:79	TCP	554 > 43771 [RST, ACK] Seq=1 Ack=1 Win=0 Len=0		10.42.42.253	10.42.42.56	60	9	4	2010-02-03 01:34:07	43771.0	554.0	4.0
9	74	00:16:cb:92:6e:dc	00:23:8b:82:1f:4a	TCP	50305 > 554 [SYN] Seq=0 Win=5840 Len=0 MSS=1460 SACK_PERM=1 TSval=3300144 TSecr=0 WS=64		10.42.42.25	10.42.42.253	74	10	4	2010-02-03 01:34:07	554.0	50305.0	5.0
10	74	70:5a:b6:51:d7:b2	00:23:8b:82:1f:4a	TCP	35168 > 389 [SYN] Seq=0 Win=5840 Len=0 MSS=1460 SACK_PERM=1 TSval=3300144 TSecr=0 WS=64		10.42.42.50	10.42.42.253	74	11	4	2010-02-03 01:34:07	389.0	35168.0	6.0
11	74	00:26:22:cb:1e:79	00:23:8b:82:1f:4a	TCP	43514 > 389 [SYN] Seq=0 Win=5840 Len=0 MSS=1460 SACK_PERM=1 TSval=3300144 TSecr=0 WS=64		10.42.42.56	10.42.42.253	74	12	4	2010-02-03 01:34:07	389.0	43514.0	7.0
12	60	00:23:8b:82:1f:4a	00:16:cb:92:6e:dc	TCP	554 > 50305 [RST, ACK] Seq=1 Ack=1 Win=0 Len=0		10.42.42.253	10.42.42.25	60	13	4	2010-02-03 01:34:07	50305.0	554.0	5.0
13	60	00:23:8b:82:1f:4a	00:26:22:cb:1e:79	TCP	389 > 43514 [RST, ACK] Seq=1 Ack=1 Win=0 Len=0		10.42.42.253	10.42.42.56	60	14	4	2010-02-03 01:34:07	43514.0	389.0	7.0
14	74	00:16:cb:92:6e:dc	00:23:8b:82:1f:4a	TCP	49945 > 389 [SYN] Seq=0 Win=5840 Len=0 MSS=1460 SACK_PERM=1 TSval=3300144 TSecr=0 WS=64		10.42.42.25	10.42.42.253	74	15	4	2010-02-03 01:34:07	389.0	49945.0	8.0
15	74	70:5a:b6:51:d7:b2	00:23:8b:82:1f:4a	TCP	37066 > 256 [SYN] Seq=0 Win=5840 Len=0 MSS=1460 SACK_PERM=1 TSval=3300144 TSecr=0 WS=64		10.42.42.50	10.42.42.253	74	16	4	2010-02-03 01:34:07	256.0	37066.0	9.0
16	74	00:26:22:cb:1e:79	00:23:8b:82:1f:4a	TCP	33239 > 256 [SYN] Seq=0 Win=5840 Len=0 MSS=1460 SACK_PERM=1 TSval=3300144 TSecr=0 WS=64		10.42.42.56	10.42.42.253	74	17	4	2010-02-03 01:34:07	256.0	33239.0	10.0
17	60	00:23:8b:82:1f:4a	70:5a:b6:51:d7:b2	TCP	554 > 38232 [RST, ACK] Seq=1 Ack=1 Win=0 Len=0		10.42.42.253	10.42.42.50	60	18	4	2010-02-03 01:34:07	38232.0	554.0	3.0
18	60	00:23:8b:82:1f:4a	70:5a:b6:51:d7:b2	TCP	389 > 35168 [RST, ACK] Seq=1 Ack=1 Win=0 Len=0		10.42.42.253	10.42.42.50	60	19	4	2010-02-03 01:34:07	35168.0	389.0	6.0
19	60	00:23:8b:82:1f:4a	00:26:22:cb:1e:79	TCP	256 > 33239 [RST, ACK] Seq=1 Ack=1 Win=0 Len=0		10.42.42.253	10.42.42.56	60	20	4	2010-02-03 01:34:07	33239.0	256.0	10.0
20	60	00:23:8b:82:1f:4a	00:16:cb:92:6e:dc	TCP	389 > 49945 [RST, ACK] Seq=1 Ack=1 Win=0 Len=0		10.42.42.253	10.42.42.25	60	21	4	2010-02-03 01:34:07	49945.0	389.0	8.0
21	60	00:23:8b:82:1f:4a	70:5a:b6:51:d7:b2	TCP	256 > 37066 [RST, ACK] Seq=1 Ack=1 Win=0 Len=0		10.42.42.253	10.42.42.50	60	22	4	2010-02-03 01:34:07	37066.0	256.0	9.0
22	74	70:5a:b6:51:d7:b2	00:23:8b:82:1f:4a	TCP	39682 > 23 [SYN] Seq=0 Win=5840 Len=0 MSS=1460 SACK_PERM=1 TSval=3300144 TSecr=0 WS=64		10.42.42.50	10.42.42.253	74	23	4	2010-02-03 01:34:07	23.0	39682.0	11.0
23	74	00:26:22:cb:1e:79	00:23:8b:82:1f:4a	TCP	60559 > 23 [SYN] Seq=0 Win=5840 Len=0 MSS=1460 SACK_PERM=1 TSval=3300144 TSecr=0 WS=64		10.42.42.56	10.42.42.253	74	24	4	2010-02-03 01:34:07	23.0	60559.0	12.0
24	60	00:23:8b:82:1f:4a	00:26:22:cb:1e:79	TCP	23 > 60559 [RST, ACK] Seq=1 Ack=1 Win=0 Len=0		10.42.42.253	10.42.42.56	60	25	4	2010-02-03 01:34:07	60559.0	23.0	12.0
25	60	00:23:8b:82:1f:4a	70:5a:b6:51:d7:b2	TCP	23 > 39682 [RST, ACK] Seq=1 Ack=1 Win=0 Len=0		10.42.42.253	10.42.42.50	60	26	4	2010-02-03 01:34:07	39682.0	23.0	11.0
26	74	00:16:cb:92:6e:dc	00:23:8b:82:1f:4a	TCP	60419 > 256 [SYN] Seq=0 Win=5840 Len=0 MSS=1460 SACK_PERM=1 TSval=3300145 TSecr=0 WS=64		10.42.42.25	10.42.42.253	74	27	4	2010-02-03 01:34:07	256.0	60419.0	13.0
27	74	70:5a:b6:51:d7:b2	00:23:8b:82:1f:4a	TCP	46561 > 80 [SYN] Seq=0 Win=5840 Len=0 MSS=1460 SACK_PERM=1 TSval=3300145 TSecr=0 WS=64		10.42.42.50	10.42.42.253	74	28	4	2010-02-03 01:34:07	80.0	46561.0	14.0
28	74	00:26:22:cb:1e:79	00:23:8b:82:1f:4a	TCP	59941 > 80 [SYN] Seq=0 Win=5840 Len=0 MSS=1460 SACK_PERM=1 TSval=3300145 TSecr=0 WS=64		10.42.42.56	10.42.42.253	74	29	4	2010-02-03 01:34:07	80.0	59941.0	15.0
29	60	00:23:8b:82:1f:4a	00:26:22:cb:1e:79	TCP	80 > 59941 [RST, ACK] Seq=1 Ack=1 Win=0 Len=0		10.42.42.253	10.42.42.56	60	30	4	2010-02-03 01:34:07	59941.0	80.0	15.0
30	60	00:23:8b:82:1f:4a	00:16:cb:92:6e:dc	TCP	256 > 60419 [RST, ACK] Seq=1 Ack=1 Win=0 Len=0		10.42.42.253	10.42.42.25	60	31	4	2010-02-03 01:34:07	60419.0	256.0	13.0
31	74	00:16:cb:92:6e:dc	00:23:8b:82:1f:4a	TCP	46672 > 23 [SYN] Seq=0 Win=5840 Len=0 MSS=1460 SACK_PERM=1 TSval=3300145 TSecr=0 WS=64		10.42.42.25	10.42.42.253	74	32	4	2010-02-03 01:34:07	23.0	46672.0	16.0
32	74	70:5a:b6:51:d7:b2	00:23:8b:82:1f:4a	TCP	59706 > 22 [SYN] Seq=0 Win=5840 Len=0 MSS=1460 SACK_PERM=1 TSval=3300145 TSecr=0 WS=64		10.42.42.50	10.42.42.253	74	33	4	2010-02-03 01:34:07	22.0	59706.0	17.0
33	60	00:23:8b:82:1f:4a	00:16:cb:92:6e:dc	TCP	23 > 46672 [RST, ACK] Seq=1 Ack=1 Win=0 Len=0		10.42.42.253	10.42.42.25	60	34	4	2010-02-03 01:34:07	46672.0	23.0	16.0
34	74	00:26:22:cb:1e:79	00:23:8b:82:1f:4a	TCP	50953 > 22 [SYN] Seq=0 Win=5840 Len=0 MSS=1460 SACK_PERM=1 TSval=3300145 TSecr=0 WS=64		10.42.42.56	10.42.42.253	74	35	4	2010-02-03 01:34:07	22.0	50953.0	18.0
35	60	00:23:8b:82:1f:4a	00:26:22:cb:1e:79	TCP	22 > 50953 [RST, ACK] Seq=1 Ack=1 Win=0 Len=0		10.42.42.253	10.42.42.56	60	36	4	2010-02-03 01:34:07	50953.0	22.0	18.0
36	60	00:23:8b:82:1f:4a	70:5a:b6:51:d7:b2	TCP	80 > 46561 [RST, ACK] Seq=1 Ack=1 Win=0 Len=0		10.42.42.253	10.42.42.50	60	37	4	2010-02-03 01:34:07	46561.0	80.0	14.0
37	60	00:23:8b:82:1f:4a	70:5a:b6:51:d7:b2	TCP	22 > 59706 [RST, ACK] Seq=1 Ack=1 Win=0 Len=0		10.42.42.253	10.42.42.50	60	38	4	2010-02-03 01:34:07	59706.0	22.0	17.0
38	74	00:16:cb:92:6e:dc	00:23:8b:82:1f:4a	TCP	41018 > 80 [SYN] Seq=0 Win=5840 Len=0 MSS=1460 SACK_PERM=1 TSval=3300145 TSecr=0 WS=64		10.42.42.25	10.42.42.253	74	39	4	2010-02-03 01:34:07	80.0	41018.0	19.0
39	74	70:5a:b6:51:d7:b2	00:23:8b:82:1f:4a	TCP	33697 > 21 [SYN] Seq=0 Win=5840 Len=0 MSS=1460 SACK_PERM=1 TSval=3300145 TSecr=0 WS=64		10.42.42.50	10.42.42.253	74	40	4	2010-02-03 01:34:07	21.0	33697.0	20.0
40	74	00:26:22:cb:1e:79	00:23:8b:82:1f:4a	TCP	51807 > 21 [SYN] Seq=0 Win=5840 Len=0 MSS=1460 SACK_PERM=1 TSval=3300145 TSecr=0 WS=64		10.42.42.56	10.42.42.253	74	41	4	2010-02-03 01:34:07	21.0	51807.0	21.0
41	60	00:23:8b:82:1f:4a	00:26:22:cb:1e:79	TCP	21 > 51807 [RST, ACK] Seq=1 Ack=1 Win=0 Len=0		10.42.42.253	10.42.42.56	60	42	4	2010-02-03 01:34:07	51807.0	21.0	21.0
42	60	00:23:8b:82:1f:4a	00:16:cb:92:6e:dc	TCP	80 > 41018 [RST, ACK] Seq=1 Ack=1 Win=0 Len=0		10.42.42.253	10.42.42.25	60	43	4	2010-02-03 01:34:07	41018.0	80.0	19.0
43	74	00:16:cb:92:6e:dc	00:23:8b:82:1f:4a	TCP	35813 > 22 [SYN] Seq=0 Win=5840 Len=0 MSS=1460 SACK_PERM=1 TSval=3300145 TSecr=0 WS=64		10.42.42.25	10.42.42.253	74	44	4	2010-02-03 01:34:07	22.0	35813.0	22.0
44	74	70:5a:b6:51:d7:b2	00:23:8b:82:1f:4a	TCP	51331 > 443 [SYN] Seq=0 Win=5840 Len=0 MSS=1460 SACK_PERM=1 TSval=3300145 TSecr=0 WS=64		10.42.42.50	10.42.42.253	74	45	4	2010-02-03 01:34:07	443.0	51331.0	23.0
45	74	00:26:22:cb:1e:79	00:23:8b:82:1f:4a	TCP	46114 > 443 [SYN] Seq=0 Win=5840 Len=0 MSS=1460 SACK_PERM=1 TSval=3300145 TSecr=0 WS=64		10.42.42.56	10.42.42.253	74	46	4	2010-02-03 01:34:07	443.0	46114.0	24.0
46	60	00:23:8b:82:1f:4a	70:5a:b6:51:d7:b2	TCP	21 > 33697 [RST, ACK] Seq=1 Ack=1 Win=0 Len=0		10.42.42.253	10.42.42.50	60	47	4	2010-02-03 01:34:07	33697.0	21.0	20.0
47	60	00:23:8b:82:1f:4a	00:26:22:cb:1e:79	TCP	443 > 46114 [RST, ACK] Seq=1 Ack=1 Win=0 Len=0		10.42.42.253	10.42.42.56	60	48	4	2010-02-03 01:34:07	46114.0	443.0	24.0
48	60	00:23:8b:82:1f:4a	00:16:cb:92:6e:dc	TCP	22 > 35813 [RST, ACK] Seq=1 Ack=1 Win=0 Len=0		10.42.42.253	10.42.42.25	60	49	4	2010-02-03 01:34:07	35813.0	22.0	22.0
49	60	00:23:8b:82:1f:4a	70:5a:b6:51:d7:b2	TCP	443 > 51331 [RST, ACK] Seq=1 Ack=1 Win=0 Len=0		10.42.42.253	10.42.42.50	60	50	4	2010-02-03 01:34:07	51331.0	443.0	23.0
50	74	00:16:cb:92:6e:dc	00:23:8b:82:1f:4a	TCP	43706 > 21 [SYN] Seq=0 Win=5840 Len=0 MSS=1460 SACK_PERM=1 TSval=3300145 TSecr=0 WS=64		10.42.42.25	10.42.42.253	74	51	4	2010-02-03 01:34:07	21.0	43706.0	25.0
51	74	70:5a:b6:51:d7:b2	00:23:8b:82:1f:4a	TCP	36834 > 3389 [SYN] Seq=0 Win=5840 Len=0 MSS=1460 SACK_PERM=1 TSval=3300145 TSecr=0 WS=64		10.42.42.50	10.42.42.253	74	52	4	2010-02-03 01:34:07	3389.0	36834.0	26.0
52	60	00:23:8b:82:1f:4a	00:16:cb:92:6e:dc	TCP	21 > 43706 [RST, ACK] Seq=1 Ack=1 Win=0 Len=0		10.42.42.253	10.42.42.25	60	53	4	2010-02-03 01:34:07	43706.0	21.0	25.0
53	74	00:26:22:cb:1e:79	00:23:8b:82:1f:4a	TCP	50121 > 3389 [SYN] Seq=0 Win=5840 Len=0 MSS=1460 SACK_PERM=1 TSval=3300145 TSecr=0 WS=64		10.42.42.56	10.42.42.253	74	54	4	2010-02-03 01:34:07	3389.0	50121.0	27.0
54	60	00:23:8b:82:1f:4a	00:26:22:cb:1e:79	TCP	3389 > 50121 [RST, ACK] Seq=1 Ack=1 Win=0 Len=0		10.42.42.253	10.42.42.56	60	55	4	2010-02-03 01:34:07	50121.0	3389.0	27.0
55	74	00:16:cb:92:6e:dc	00:23:8b:82:1f:4a	TCP	44878 > 443 [SYN] Seq=0 Win=5840 Len=0 MSS=1460 SACK_PERM=1 TSval=3300145 TSecr=0 WS=64		10.42.42.25	10.42.42.253	74	56	4	2010-02-03 01:34:07	443.0	44878.0	28.0
56	74	70:5a:b6:51:d7:b2	00:23:8b:82:1f:4a	TCP	34135 > 113 [SYN] Seq=0 Win=5840 Len=0 MSS=1460 SACK_PERM=1 TSval=3300145 TSecr=0 WS=64		10.42.42.50	10.42.42.253	74	57	4	2010-02-03 01:34:07	113.0	34135.0	29.0
57	74	00:26:22:cb:1e:79	00:23:8b:82:1f:4a	TCP	50013 > 113 [SYN] Seq=0 Win=5840 Len=0 MSS=1460 SACK_PERM=1 TSval=3300145 TSecr=0 WS=64		10.42.42.56	10.42.42.253	74	58	4	2010-02-03 01:34:07	113.0	50013.0	30.0
58	60	00:23:8b:82:1f:4a	70:5a:b6:51:d7:b2	TCP	3389 > 36834 [RST, ACK] Seq=1 Ack=1 Win=0 Len=0		10.42.42.253	10.42.42.50	60	59	4	2010-02-03 01:34:07	36834.0	3389.0	26.0
59	60	00:23:8b:82:1f:4a	70:5a:b6:51:d7:b2	TCP	113 > 34135 [RST, ACK] Seq=1 Ack=1 Win=0 Len=0		10.42.42.253	10.42.42.50	60	60	4	2010-02-03 01:34:07	34135.0	113.0	29.0
60	60	00:23:8b:82:1f:4a	00:16:cb:92:6e:dc	TCP	443 > 44878 [RST, ACK] Seq=1 Ack=1 Win=0 Len=0		10.42.42.253	10.42.42.25	60	61	4	2010-02-03 01:34:07	44878.0	443.0	28.0
61	60	00:23:8b:82:1f:4a	00:26:22:cb:1e:79	TCP	113 > 50013 [RST, ACK] Seq=1 Ack=1 Win=0 Len=0		10.42.42.253	10.42.42.56	60	62	4	2010-02-03 01:34:07	50013.0	113.0	30.0
62	74	00:16:cb:92:6e:dc	00:23:8b:82:1f:4a	TCP	50402 > 3389 [SYN] Seq=0 Win=5840 Len=0 MSS=1460 SACK_PERM=1 TSval=3300145 TSecr=0 WS=64		10.42.42.25	10.42.42.253	74	63	4	2010-02-03 01:34:07	3389.0	50402.0	31.0
63	74	70:5a:b6:51:d7:b2	00:23:8b:82:1f:4a	TCP	40191 > 53 [SYN] Seq=0 Win=5840 Len=0 MSS=1460 SACK_PERM=1 TSval=3300145 TSecr=0 WS=64		10.42.42.50	10.42.42.253	74	64	4	2010-02-03 01:34:07	53.0	40191.0	32.0
64	74	00:26:22:cb:1e:79	00:23:8b:82:1f:4a	TCP	41828 > 53 [SYN] Seq=0 Win=5840 Len=0 MSS=1460 SACK_PERM=1 TSval=3300145 TSecr=0 WS=64		10.42.42.56	10.42.42.253	74	65	4	2010-02-03 01:34:07	53.0	41828.0	33.0
65	60	00:23:8b:82:1f:4a	00:16:cb:92:6e:dc	TCP	3389 > 50402 [RST, ACK] Seq=1 Ack=1 Win=0 Len=0		10.42.42.253	10.42.42.25	60	66	4	2010-02-03 01:34:07	50402.0	3389.0	31.0
66	60	00:23:8b:82:1f:4a	00:26:22:cb:1e:79	TCP	53 > 41828 [RST, ACK] Seq=1 Ack=1 Win=0 Len=0		10.42.42.253	10.42.42.56	60	67	4	2010-02-03 01:34:07	41828.0	53.0	33.0
67	74	00:16:cb:92:6e:dc	00:23:8b:82:1f:4a	TCP	60791 > 113 [SYN] Seq=0 Win=5840 Len=0 MSS=1460 SACK_PERM=1 TSval=3300145 TSecr=0 WS=64		10.42.42.25	10.42.42.253	74	68	4	2010-02-03 01:34:07	113.0	60791.0	34.0
68	74	70:5a:b6:51:d7:b2	00:23:8b:82:1f:4a	TCP	56976 > 636 [SYN] Seq=0 Win=5840 Len=0 MSS=1460 SACK_PERM=1 TSval=3300145 TSecr=0 WS=64		10.42.42.50	10.42.42.253	74	69	4	2010-02-03 01:34:07	636.0	56976.0	35.0
69	74	00:26:22:cb:1e:79	00:23:8b:82:1f:4a	TCP	42026 > 636 [SYN] Seq=0 Win=5840 Len=0 MSS=1460 SACK_PERM=1 TSval=3300145 TSecr=0 WS=64		10.42.42.56	10.42.42.253	74	70	4	2010-02-03 01:34:07	636.0	42026.0	36.0
70	60	00:23:8b:82:1f:4a	00:26:22:cb:1e:79	TCP	636 > 42026 [RST, ACK] Seq=1 Ack=1 Win=0 Len=0		10.42.42.253	10.42.42.56	60	71	4	2010-02-03 01:34:07	42026.0	636.0	36.0
71	60	00:23:8b:82:1f:4a	00:16:cb:92:6e:dc	TCP	113 > 60791 [RST, ACK] Seq=1 Ack=1 Win=0 Len=0		10.42.42.253	10.42.42.25	60	72	4	2010-02-03 01:34:07	60791.0	113.0	34.0
72	60	00:23:8b:82:1f:4a	70:5a:b6:51:d7:b2	TCP	53 > 40191 [RST, ACK] Seq=1 Ack=1 Win=0 Len=0		10.42.42.253	10.42.42.50	60	73	4	2010-02-03 01:34:07	40191.0	53.0	32.0
73	60	00:23:8b:82:1f:4a	70:5a:b6:51:d7:b2	TCP	636 > 56976 [RST, ACK] Seq=1 Ack=1 Win=0 Len=0		10.42.42.253	10.42.42.50	60	74	4	2010-02-03 01:34:07	56976.0	636.0	35.0
74	74	00:16:cb:92:6e:dc	00:23:8b:82:1f:4a	TCP	48126 > 53 [SYN] Seq=0 Win=5840 Len=0 MSS=1460 SACK_PERM=1 TSval=3300145 TSecr=0 WS=64		10.42.42.25	10.42.42.253	74	75	4	2010-02-03 01:34:07	53.0	48126.0	37.0
75	74	70:5a:b6:51:d7:b2	00:23:8b:82:1f:4a	TCP	36290 > 25 [SYN] Seq=0 Win=5840 Len=0 MSS=1460 SACK_PERM=1 TSval=3300145 TSecr=0 WS=64		10.42.42.50	10.42.42.253	74	76	4	2010-02-03 01:34:07	25.0	36290.0	38.0
76	74	00:26:22:cb:1e:79	00:23:8b:82:1f:4a	TCP	34878 > 25 [SYN] Seq=0 Win=5840 Len=0 MSS=1460 SACK_PERM=1 TSval=3300145 TSecr=0 WS=64		10.42.42.56	10.42.42.253	74	77	4	2010-02-03 01:34:07	25.0	34878.0	39.0
77	60	00:23:8b:82:1f:4a	00:16:cb:92:6e:dc	TCP	53 > 48126 [RST, ACK] Seq=1 Ack=1 Win=0 Len=0		10.42.42.253	10.42.42.25	60	78	4	2010-02-03 01:34:07	48126.0	53.0	37.0
78	60	00:23:8b:82:1f:4a	00:26:22:cb:1e:79	TCP	25 > 34878 [RST, ACK] Seq=1 Ack=1 Win=0 Len=0		10.42.42.253	10.42.42.56	60	79	4	2010-02-03 01:34:07	34878.0	25.0	39.0
79	60	00:23:8b:82:1f:4a	70:5a:b6:51:d7:b2	TCP	25 > 36290 [RST, ACK] Seq=1 Ack=1 Win=0 Len=0		10.42.42.253	10.42.42.50	60	80	4	2010-02-03 01:34:07	36290.0	25.0	38.0
80	74	00:26:22:cb:1e:79	00:23:8b:82:1f:4a	TCP	58725 > 1723 [SYN] Seq=0 Win=5840 Len=0 MSS=1460 SACK_PERM=1 TSval=3300146 TSecr=0 WS=64		10.42.42.56	10.42.42.253	74	81	4	2010-02-03 01:34:07	1723.0	58725.0	40.0
81	60	00:23:8b:82:1f:4a	00:26:22:cb:1e:79	TCP	1723 > 58725 [RST, ACK] Seq=1 Ack=1 Win=0 Len=0		10.42.42.253	10.42.42.56	60	82	4	2010-02-03 01:34:07	58725.0	1723.0	40.0
82	74	00:16:cb:92:6e:dc	00:23:8b:82:1f:4a	TCP	38726 > 636 [SYN] Seq=0 Win=5840 Len=0 MSS=1460 SACK_PERM=1 TSval=3300146 TSecr=0 WS=64		10.42.42.25	10.42.42.253	74	83	4	2010-02-03 01:34:07	636.0	38726.0	41.0
83	74	70:5a:b6:51:d7:b2	00:23:8b:82:1f:4a	TCP	48823 > 1723 [SYN] Seq=0 Win=5840 Len=0 MSS=1460 SACK_PERM=1 TSval=3300146 TSecr=0 WS=64		10.42.42.50	10.42.42.253	74	84	4	2010-02-03 01:34:07	1723.0	48823.0	42.0
84	74	00:26:22:cb:1e:79	00:23:8b:82:1f:4a	TCP	53918 > 34573 [SYN] Seq=0 Win=5840 Len=0 MSS=1460 SACK_PERM=1 TSval=3300146 TSecr=0 WS=64		10.42.42.56	10.42.42.253	74	85	4	2010-02-03 01:34:07	34573.0	53918.0	43.0
85	60	00:23:8b:82:1f:4a	00:26:22:cb:1e:79	TCP	34573 > 53918 [RST, ACK] Seq=1 Ack=1 Win=0 Len=0		10.42.42.253	10.42.42.56	60	86	4	2010-02-03 01:34:07	53918.0	34573.0	43.0
86	60	00:23:8b:82:1f:4a	00:16:cb:92:6e:dc	TCP	636 > 38726 [RST, ACK] Seq=1 Ack=1 Win=0 Len=0		10.42.42.253	10.42.42.25	60	87	4	2010-02-03 01:34:07	38726.0	636.0	41.0
87	74	00:16:cb:92:6e:dc	00:23:8b:82:1f:4a	TCP	38218 > 25 [SYN] Seq=0 Win=5840 Len=0 MSS=1460 SACK_PERM=1 TSval=3300146 TSecr=0 WS=64		10.42.42.25	10.42.42.253	74	88	4	2010-02-03 01:34:07	25.0	38218.0	44.0
88	74	70:5a:b6:51:d7:b2	00:23:8b:82:1f:4a	TCP	40676 > 34573 [SYN] Seq=0 Win=5840 Len=0 MSS=1460 SACK_PERM=1 TSval=3300146 TSecr=0 WS=64		10.42.42.50	10.42.42.253	74	89	4	2010-02-03 01:34:07	34573.0	40676.0	45.0
89	74	00:26:22:cb:1e:79	00:23:8b:82:1f:4a	TCP	40811 > 4224 [SYN] Seq=0 Win=5840 Len=0 MSS=1460 SACK_PERM=1 TSval=3300146 TSecr=0 WS=64		10.42.42.56	10.42.42.253	74	90	4	2010-02-03 01:34:07	4224.0	40811.0	46.0
90	60	00:23:8b:82:1f:4a	00:16:cb:92:6e:dc	TCP	25 > 38218 [RST, ACK] Seq=1 Ack=1 Win=0 Len=0		10.42.42.253	10.42.42.25	60	91	4	2010-02-03 01:34:07	38218.0	25.0	44.0
91	60	00:23:8b:82:1f:4a	00:26:22:cb:1e:79	TCP	4224 > 40811 [RST, ACK] Seq=1 Ack=1 Win=0 Len=0		10.42.42.253	10.42.42.56	60	92	4	2010-02-03 01:34:07	40811.0	4224.0	46.0
92	74	00:16:cb:92:6e:dc	00:23:8b:82:1f:4a	TCP	35275 > 1723 [SYN] Seq=0 Win=5840 Len=0 MSS=1460 SACK_PERM=1 TSval=3300146 TSecr=0 WS=64		10.42.42.25	10.42.42.253	74	93	4	2010-02-03 01:34:07	1723.0	35275.0	47.0
93	74	70:5a:b6:51:d7:b2	00:23:8b:82:1f:4a	TCP	46400 > 4224 [SYN] Seq=0 Win=5840 Len=0 MSS=1460 SACK_PERM=1 TSval=3300146 TSecr=0 WS=64		10.42.42.50	10.42.42.253	74	94	4	2010-02-03 01:34:07	4224.0	46400.0	48.0
94	74	00:26:22:cb:1e:79	00:23:8b:82:1f:4a	TCP	47435 > 6667 [SYN] Seq=0 Win=5840 Len=0 MSS=1460 SACK_PERM=1 TSval=3300146 TSecr=0 WS=64		10.42.42.56	10.42.42.253	74	95	4	2010-02-03 01:34:07	6667.0	47435.0	49.0
95	60	00:23:8b:82:1f:4a	00:16:cb:92:6e:dc	TCP	1723 > 35275 [RST, ACK] Seq=1 Ack=1 Win=0 Len=0		10.42.42.253	10.42.42.25	60	96	4	2010-02-03 01:34:07	35275.0	1723.0	47.0
96	60	00:23:8b:82:1f:4a	70:5a:b6:51:d7:b2	TCP	1723 > 48823 [RST, ACK] Seq=1 Ack=1 Win=0 Len=0		10.42.42.253	10.42.42.50	60	97	4	2010-02-03 01:34:07	48823.0	1723.0	42.0
97	60	00:23:8b:82:1f:4a	70:5a:b6:51:d7:b2	TCP	34573 > 40676 [RST, ACK] Seq=1 Ack=1 Win=0 Len=0		10.42.42.253	10.42.42.50	60	98	4	2010-02-03 01:34:07	40676.0	34573.0	45.0
98	60	00:23:8b:82:1f:4a	70:5a:b6:51:d7:b2	TCP	4224 > 46400 [RST, ACK] Seq=1 Ack=1 Win=0 Len=0		10.42.42.253	10.42.42.50	60	99	4	2010-02-03 01:34:07	46400.0	4224.0	48.0
99	60	00:23:8b:82:1f:4a	00:26:22:cb:1e:79	TCP	6667 > 47435 [RST, ACK] Seq=1 Ack=1 Win=0 Len=0		10.42.42.253	10.42.42.56	60	100	4	2010-02-03 01:34:07	47435.0	6667.0	49.0
100	74	00:16:cb:92:6e:dc	00:23:8b:82:1f:4a	TCP	38316 > 34573 [SYN] Seq=0 Win=5840 Len=0 MSS=1460 SACK_PERM=1 TSval=3300146 TSecr=0 WS=64		10.42.42.25	10.42.42.253	74	101	4	2010-02-03 01:34:07	34573.0	38316.0	50.0
101	74	70:5a:b6:51:d7:b2	00:23:8b:82:1f:4a	TCP	40800 > 6667 [SYN] Seq=0 Win=5840 Len=0 MSS=1460 SACK_PERM=1 TSval=3300146 TSecr=0 WS=64		10.42.42.50	10.42.42.253	74	102	4	2010-02-03 01:34:07	6667.0	40800.0	51.0
102	74	00:26:22:cb:1e:79	00:23:8b:82:1f:4a	TCP	50914 > 1761 [SYN] Seq=0 Win=5840 Len=0 MSS=1460 SACK_PERM=1 TSval=3300146 TSecr=0 WS=64		10.42.42.56	10.42.42.253	74	103	4	2010-02-03 01:34:07	1761.0	50914.0	52.0
103	60	00:23:8b:82:1f:4a	00:26:22:cb:1e:79	TCP	1761 > 50914 [RST, ACK] Seq=1 Ack=1 Win=0 Len=0		10.42.42.253	10.42.42.56	60	104	4	2010-02-03 01:34:07	50914.0	1761.0	52.0
104	60	00:23:8b:82:1f:4a	00:16:cb:92:6e:dc	TCP	34573 > 38316 [RST, ACK] Seq=1 Ack=1 Win=0 Len=0		10.42.42.253	10.42.42.25	60	105	4	2010-02-03 01:34:07	38316.0	34573.0	50.0
105	74	00:16:cb:92:6e:dc	00:23:8b:82:1f:4a	TCP	42069 > 4224 [SYN] Seq=0 Win=5840 Len=0 MSS=1460 SACK_PERM=1 TSval=3300146 TSecr=0 WS=64		10.42.42.25	10.42.42.253	74	106	4	2010-02-03 01:34:07	4224.0	42069.0	53.0
106	74	70:5a:b6:51:d7:b2	00:23:8b:82:1f:4a	TCP	59535 > 1761 [SYN] Seq=0 Win=5840 Len=0 MSS=1460 SACK_PERM=1 TSval=3300146 TSecr=0 WS=64		10.42.42.50	10.42.42.253	74	107	4	2010-02-03 01:34:07	1761.0	59535.0	54.0
107	60	00:23:8b:82:1f:4a	00:16:cb:92:6e:dc	TCP	4224 > 42069 [RST, ACK] Seq=1 Ack=1 Win=0 Len=0		10.42.42.253	10.42.42.25	60	108	4	2010-02-03 01:34:07	42069.0	4224.0	53.0
108	74	00:26:22:cb:1e:79	00:23:8b:82:1f:4a	TCP	37505 > 8402 [SYN] Seq=0 Win=5840 Len=0 MSS=1460 SACK_PERM=1 TSval=3300146 TSecr=0 WS=64		10.42.42.56	10.42.42.253	74	109	4	2010-02-03 01:34:07	8402.0	37505.0	55.0
109	60	00:23:8b:82:1f:4a	70:5a:b6:51:d7:b2	TCP	6667 > 40800 [RST, ACK] Seq=1 Ack=1 Win=0 Len=0		10.42.42.253	10.42.42.50	60	110	4	2010-02-03 01:34:07	40800.0	6667.0	51.0
110	60	00:23:8b:82:1f:4a	70:5a:b6:51:d7:b2	TCP	1761 > 59535 [RST, ACK] Seq=1 Ack=1 Win=0 Len=0		10.42.42.253	10.42.42.50	60	111	4	2010-02-03 01:34:07	59535.0	1761.0	54.0
111	60	00:23:8b:82:1f:4a	00:26:22:cb:1e:79	TCP	8402 > 37505 [RST, ACK] Seq=1 Ack=1 Win=0 Len=0		10.42.42.253	10.42.42.56	60	112	4	2010-02-03 01:34:07	37505.0	8402.0	55.0
112	74	00:16:cb:92:6e:dc	00:23:8b:82:1f:4a	TCP	35615 > 6667 [SYN] Seq=0 Win=5840 Len=0 MSS=1460 SACK_PERM=1 TSval=3300146 TSecr=0 WS=64		10.42.42.25	10.42.42.253	74	113	4	2010-02-03 01:34:07	6667.0	35615.0	56.0
113	74	70:5a:b6:51:d7:b2	00:23:8b:82:1f:4a	TCP	37056 > 8402 [SYN] Seq=0 Win=5840 Len=0 MSS=1460 SACK_PERM=1 TSval=3300146 TSecr=0 WS=64		10.42.42.50	10.42.42.253	74	114	4	2010-02-03 01:34:07	8402.0	37056.0	57.0
114	74	00:26:22:cb:1e:79	00:23:8b:82:1f:4a	TCP	36126 > 2005 [SYN] Seq=0 Win=5840 Len=0 MSS=1460 SACK_PERM=1 TSval=3300146 TSecr=0 WS=64		10.42.42.56	10.42.42.253	74	115	4	2010-02-03 01:34:07	2005.0	36126.0	58.0
115	60	00:23:8b:82:1f:4a	00:26:22:cb:1e:79	TCP	2005 > 36126 [RST, ACK] Seq=1 Ack=1 Win=0 Len=0		10.42.42.253	10.42.42.56	60	116	4	2010-02-03 01:34:07	36126.0	2005.0	58.0
116	60	00:23:8b:82:1f:4a	00:16:cb:92:6e:dc	TCP	6667 > 35615 [RST, ACK] Seq=1 Ack=1 Win=0 Len=0		10.42.42.253	10.42.42.25	60	117	4	2010-02-03 01:34:07	35615.0	6667.0	56.0
117	74	00:16:cb:92:6e:dc	00:23:8b:82:1f:4a	TCP	52570 > 1761 [SYN] Seq=0 Win=5840 Len=0 MSS=1460 SACK_PERM=1 TSval=3300146 TSecr=0 WS=64		10.42.42.25	10.42.42.253	74	118	4	2010-02-03 01:34:07	1761.0	52570.0	59.0
118	74	70:5a:b6:51:d7:b2	00:23:8b:82:1f:4a	TCP	36615 > 2005 [SYN] Seq=0 Win=5840 Len=0 MSS=1460 SACK_PERM=1 TSval=3300146 TSecr=0 WS=64		10.42.42.50	10.42.42.253	74	119	4	2010-02-03 01:34:07	2005.0	36615.0	60.0
119	60	00:23:8b:82:1f:4a	00:16:cb:92:6e:dc	TCP	1761 > 52570 [RST, ACK] Seq=1 Ack=1 Win=0 Len=0		10.42.42.253	10.42.42.25	60	120	4	2010-02-03 01:34:07	52570.0	1761.0	59.0
120	74	00:26:22:cb:1e:79	00:23:8b:82:1f:4a	TCP	33903 > 1009 [SYN] Seq=0 Win=5840 Len=0 MSS=1460 SACK_PERM=1 TSval=3300146 TSecr=0 WS=64		10.42.42.56	10.42.42.253	74	121	4	2010-02-03 01:34:07	1009.0	33903.0	61.0
121	60	00:23:8b:82:1f:4a	00:26:22:cb:1e:79	TCP	1009 > 33903 [RST, ACK] Seq=1 Ack=1 Win=0 Len=0		10.42.42.253	10.42.42.56	60	122	4	2010-02-03 01:34:07	33903.0	1009.0	61.0
122	60	00:23:8b:82:1f:4a	70:5a:b6:51:d7:b2	TCP	8402 > 37056 [RST, ACK] Seq=1 Ack=1 Win=0 Len=0		10.42.42.253	10.42.42.50	60	123	4	2010-02-03 01:34:07	37056.0	8402.0	57.0
123	60	00:23:8b:82:1f:4a	70:5a:b6:51:d7:b2	TCP	2005 > 36615 [RST, ACK] Seq=1 Ack=1 Win=0 Len=0		10.42.42.253	10.42.42.50	60	124	4	2010-02-03 01:34:07	36615.0	2005.0	60.0
124	74	00:16:cb:92:6e:dc	00:23:8b:82:1f:4a	TCP	45489 > 8402 [SYN] Seq=0 Win=5840 Len=0 MSS=1460 SACK_PERM=1 TSval=3300146 TSecr=0 WS=64		10.42.42.25	10.42.42.253	74	125	4	2010-02-03 01:34:07	8402.0	45489.0	62.0
125	74	70:5a:b6:51:d7:b2	00:23:8b:82:1f:4a	TCP	39045 > 1009 [SYN] Seq=0 Win=5840 Len=0 MSS=1460 SACK_PERM=1 TSval=3300146 TSecr=0 WS=64		10.42.42.50	10.42.42.253	74	126	4	2010-02-03 01:34:07	1009.0	39045.0	63.0
126	74	00:26:22:cb:1e:79	00:23:8b:82:1f:4a	TCP	45976 > 1073 [SYN] Seq=0 Win=5840 Len=0 MSS=1460 SACK_PERM=1 TSval=3300146 TSecr=0 WS=64		10.42.42.56	10.42.42.253	74	127	4	2010-02-03 01:34:07	1073.0	45976.0	64.0
127	60	00:23:8b:82:1f:4a	00:26:22:cb:1e:79	TCP	1073 > 45976 [RST, ACK] Seq=1 Ack=1 Win=0 Len=0		10.42.42.253	10.42.42.56	60	128	4	2010-02-03 01:34:07	45976.0	1073.0	64.0
128	60	00:23:8b:82:1f:4a	00:16:cb:92:6e:dc	TCP	8402 > 45489 [RST, ACK] Seq=1 Ack=1 Win=0 Len=0		10.42.42.253	10.42.42.25	60	129	4	2010-02-03 01:34:07	45489.0	8402.0	62.0
129	74	00:16:cb:92:6e:dc	00:23:8b:82:1f:4a	TCP	49341 > 2005 [SYN] Seq=0 Win=5840 Len=0 MSS=1460 SACK_PERM=1 TSval=3300146 TSecr=0 WS=64		10.42.42.25	10.42.42.253	74	130	4	2010-02-03 01:34:07	2005.0	49341.0	65.0
130	74	70:5a:b6:51:d7:b2	00:23:8b:82:1f:4a	TCP	35768 > 1073 [SYN] Seq=0 Win=5840 Len=0 MSS=1460 SACK_PERM=1 TSval=3300146 TSecr=0 WS=64		10.42.42.50	10.42.42.253	74	131	4	2010-02-03 01:34:07	1073.0	35768.0	66.0
131	74	00:26:22:cb:1e:79	00:23:8b:82:1f:4a	TCP	37405 > 8180 [SYN] Seq=0 Win=5840 Len=0 MSS=1460 SACK_PERM=1 TSval=3300146 TSecr=0 WS=64		10.42.42.56	10.42.42.253	74	132	4	2010-02-03 01:34:07	8180.0	37405.0	67.0
132	60	00:23:8b:82:1f:4a	00:26:22:cb:1e:79	TCP	8180 > 37405 [RST, ACK] Seq=1 Ack=1 Win=0 Len=0		10.42.42.253	10.42.42.56	60	133	4	2010-02-03 01:34:07	37405.0	8180.0	67.0
133	60	00:23:8b:82:1f:4a	00:16:cb:92:6e:dc	TCP	2005 > 49341 [RST, ACK] Seq=1 Ack=1 Win=0 Len=0		10.42.42.253	10.42.42.25	60	134	4	2010-02-03 01:34:07	49341.0	2005.0	65.0
134	60	00:23:8b:82:1f:4a	70:5a:b6:51:d7:b2	TCP	1009 > 39045 [RST, ACK] Seq=1 Ack=1 Win=0 Len=0		10.42.42.253	10.42.42.50	60	135	4	2010-02-03 01:34:07	39045.0	1009.0	63.0
135	60	00:23:8b:82:1f:4a	70:5a:b6:51:d7:b2	TCP	1073 > 35768 [RST, ACK] Seq=1 Ack=1 Win=0 Len=0		10.42.42.253	10.42.42.50	60	136	4	2010-02-03 01:34:07	35768.0	1073.0	66.0
136	74	00:16:cb:92:6e:dc	00:23:8b:82:1f:4a	TCP	48927 > 1009 [SYN] Seq=0 Win=5840 Len=0 MSS=1460 SACK_PERM=1 TSval=3300146 TSecr=0 WS=64		10.42.42.25	10.42.42.253	74	137	4	2010-02-03 01:34:07	1009.0	48927.0	68.0
137	74	70:5a:b6:51:d7:b2	00:23:8b:82:1f:4a	TCP	57034 > 8180 [SYN] Seq=0 Win=5840 Len=0 MSS=1460 SACK_PERM=1 TSval=3300146 TSecr=0 WS=64		10.42.42.50	10.42.42.253	74	138	4	2010-02-03 01:34:07	8180.0	57034.0	69.0
138	74	00:26:22:cb:1e:79	00:23:8b:82:1f:4a	TCP	49002 > 999 [SYN] Seq=0 Win=5840 Len=0 MSS=1460 SACK_PERM=1 TSval=3300146 TSecr=0 WS=64		10.42.42.56	10.42.42.253	74	139	4	2010-02-03 01:34:07	999.0	49002.0	70.0
139	60	00:23:8b:82:1f:4a	70:5a:b6:51:d7:b2	TCP	8180 > 57034 [RST, ACK] Seq=1 Ack=1 Win=0 Len=0		10.42.42.253	10.42.42.50	60	140	4	2010-02-03 01:34:07	57034.0	8180.0	69.0
140	60	00:23:8b:82:1f:4a	00:26:22:cb:1e:79	TCP	999 > 49002 [RST, ACK] Seq=1 Ack=1 Win=0 Len=0		10.42.42.253	10.42.42.56	60	141	4	2010-02-03 01:34:07	49002.0	999.0	70.0
141	60	00:23:8b:82:1f:4a	00:16:cb:92:6e:dc	TCP	1009 > 48927 [RST, ACK] Seq=1 Ack=1 Win=0 Len=0		10.42.42.253	10.42.42.25	60	142	4	2010-02-03 01:34:07	48927.0	1009.0	68.0
142	74	00:16:cb:92:6e:dc	00:23:8b:82:1f:4a	TCP	43638 > 1073 [SYN] Seq=0 Win=5840 Len=0 MSS=1460 SACK_PERM=1 TSval=3300146 TSecr=0 WS=64		10.42.42.25	10.42.42.253	74	143	4	2010-02-03 01:34:07	1073.0	43638.0	71.0
143	74	70:5a:b6:51:d7:b2	00:23:8b:82:1f:4a	TCP	45915 > 999 [SYN] Seq=0 Win=5840 Len=0 MSS=1460 SACK_PERM=1 TSval=3300146 TSecr=0 WS=64		10.42.42.50	10.42.42.253	74	144	4	2010-02-03 01:34:07	999.0	45915.0	72.0
144	74	00:26:22:cb:1e:79	00:23:8b:82:1f:4a	TCP	60749 > 33354 [SYN] Seq=0 Win=5840 Len=0 MSS=1460 SACK_PERM=1 TSval=3300146 TSecr=0 WS=64		10.42.42.56	10.42.42.253	74	145	4	2010-02-03 01:34:07	33354.0	60749.0	73.0
145	60	00:23:8b:82:1f:4a	70:5a:b6:51:d7:b2	TCP	999 > 45915 [RST, ACK] Seq=1 Ack=1 Win=0 Len=0		10.42.42.253	10.42.42.50	60	146	4	2010-02-03 01:34:07	45915.0	999.0	72.0
146	60	00:23:8b:82:1f:4a	00:16:cb:92:6e:dc	TCP	1073 > 43638 [RST, ACK] Seq=1 Ack=1 Win=0 Len=0		10.42.42.253	10.42.42.25	60	147	4	2010-02-03 01:34:07	43638.0	1073.0	71.0
147	60	00:23:8b:82:1f:4a	00:26:22:cb:1e:79	TCP	33354 > 60749 [RST, ACK] Seq=1 Ack=1 Win=0 Len=0		10.42.42.253	10.42.42.56	60	148	4	2010-02-03 01:34:07	60749.0	33354.0	73.0
148	74	00:16:cb:92:6e:dc	00:23:8b:82:1f:4a	TCP	59073 > 8180 [SYN] Seq=0 Win=5840 Len=0 MSS=1460 SACK_PERM=1 TSval=3300146 TSecr=0 WS=64		10.42.42.25	10.42.42.253	74	149	4	2010-02-03 01:34:07	8180.0	59073.0	74.0
149	74	70:5a:b6:51:d7:b2	00:23:8b:82:1f:4a	TCP	54774 > 33354 [SYN] Seq=0 Win=5840 Len=0 MSS=1460 SACK_PERM=1 TSval=3300146 TSecr=0 WS=64		10.42.42.50	10.42.42.253	74	150	4	2010-02-03 01:34:07	33354.0	54774.0	75.0
150	74	00:26:22:cb:1e:79	00:23:8b:82:1f:4a	TCP	44500 > 9003 [SYN] Seq=0 Win=5840 Len=0 MSS=1460 SACK_PERM=1 TSval=3300146 TSecr=0 WS=64		10.42.42.56	10.42.42.253	74	151	4	2010-02-03 01:34:07	9003.0	44500.0	76.0
151	60	00:23:8b:82:1f:4a	00:16:cb:92:6e:dc	TCP	8180 > 59073 [RST, ACK] Seq=1 Ack=1 Win=0 Len=0		10.42.42.253	10.42.42.25	60	152	4	2010-02-03 01:34:07	59073.0	8180.0	74.0
152	60	00:23:8b:82:1f:4a	00:26:22:cb:1e:79	TCP	9003 > 44500 [RST, ACK] Seq=1 Ack=1 Win=0 Len=0		10.42.42.253	10.42.42.56	60	153	4	2010-02-03 01:34:07	44500.0	9003.0	76.0
153	60	00:23:8b:82:1f:4a	70:5a:b6:51:d7:b2	TCP	33354 > 54774 [RST, ACK] Seq=1 Ack=1 Win=0 Len=0		10.42.42.253	10.42.42.50	60	154	4	2010-02-03 01:34:07	54774.0	33354.0	75.0
154	74	00:26:22:cb:1e:79	00:23:8b:82:1f:4a	TCP	36716 > 555 [SYN] Seq=0 Win=5840 Len=0 MSS=1460 SACK_PERM=1 TSval=3300147 TSecr=0 WS=64		10.42.42.56	10.42.42.253	74	155	4	2010-02-03 01:34:07	555.0	36716.0	77.0
155	60	00:23:8b:82:1f:4a	00:26:22:cb:1e:79	TCP	555 > 36716 [RST, ACK] Seq=1 Ack=1 Win=0 Len=0		10.42.42.253	10.42.42.56	60	156	4	2010-02-03 01:34:07	36716.0	555.0	77.0
156	74	00:16:cb:92:6e:dc	00:23:8b:82:1f:4a	TCP	34434 > 999 [SYN] Seq=0 Win=5840 Len=0 MSS=1460 SACK_PERM=1 TSval=3300147 TSecr=0 WS=64		10.42.42.25	10.42.42.253	74	157	4	2010-02-03 01:34:07	999.0	34434.0	78.0
157	74	70:5a:b6:51:d7:b2	00:23:8b:82:1f:4a	TCP	39488 > 9003 [SYN] Seq=0 Win=5840 Len=0 MSS=1460 SACK_PERM=1 TSval=3300147 TSecr=0 WS=64		10.42.42.50	10.42.42.253	74	158	4	2010-02-03 01:34:07	9003.0	39488.0	79.0
158	74	00:26:22:cb:1e:79	00:23:8b:82:1f:4a	TCP	57027 > 1174 [SYN] Seq=0 Win=5840 Len=0 MSS=1460 SACK_PERM=1 TSval=3300147 TSecr=0 WS=64		10.42.42.56	10.42.42.253	74	159	4	2010-02-03 01:34:07	1174.0	57027.0	80.0
159	60	00:23:8b:82:1f:4a	00:26:22:cb:1e:79	TCP	1174 > 57027 [RST, ACK] Seq=1 Ack=1 Win=0 Len=0		10.42.42.253	10.42.42.56	60	160	4	2010-02-03 01:34:07	57027.0	1174.0	80.0
160	60	00:23:8b:82:1f:4a	00:16:cb:92:6e:dc	TCP	999 > 34434 [RST, ACK] Seq=1 Ack=1 Win=0 Len=0		10.42.42.253	10.42.42.25	60	161	4	2010-02-03 01:34:07	34434.0	999.0	78.0
161	74	00:16:cb:92:6e:dc	00:23:8b:82:1f:4a	TCP	42141 > 33354 [SYN] Seq=0 Win=5840 Len=0 MSS=1460 SACK_PERM=1 TSval=3300147 TSecr=0 WS=64		10.42.42.25	10.42.42.253	74	162	4	2010-02-03 01:34:07	33354.0	42141.0	81.0
162	74	70:5a:b6:51:d7:b2	00:23:8b:82:1f:4a	TCP	34068 > 555 [SYN] Seq=0 Win=5840 Len=0 MSS=1460 SACK_PERM=1 TSval=3300147 TSecr=0 WS=64		10.42.42.50	10.42.42.253	74	163	4	2010-02-03 01:34:07	555.0	34068.0	82.0
163	74	00:26:22:cb:1e:79	00:23:8b:82:1f:4a	TCP	51207 > 144 [SYN] Seq=0 Win=5840 Len=0 MSS=1460 SACK_PERM=1 TSval=3300147 TSecr=0 WS=64		10.42.42.56	10.42.42.253	74	164	4	2010-02-03 01:34:07	144.0	51207.0	83.0
164	60	00:23:8b:82:1f:4a	00:26:22:cb:1e:79	TCP	144 > 51207 [RST, ACK] Seq=1 Ack=1 Win=0 Len=0		10.42.42.253	10.42.42.56	60	165	4	2010-02-03 01:34:07	51207.0	144.0	83.0
165	60	00:23:8b:82:1f:4a	00:16:cb:92:6e:dc	TCP	33354 > 42141 [RST, ACK] Seq=1 Ack=1 Win=0 Len=0		10.42.42.253	10.42.42.25	60	166	4	2010-02-03 01:34:07	42141.0	33354.0	81.0
166	74	00:16:cb:92:6e:dc	00:23:8b:82:1f:4a	TCP	52141 > 9003 [SYN] Seq=0 Win=5840 Len=0 MSS=1460 SACK_PERM=1 TSval=3300147 TSecr=0 WS=64		10.42.42.25	10.42.42.253	74	167	4	2010-02-03 01:34:07	9003.0	52141.0	84.0
167	74	70:5a:b6:51:d7:b2	00:23:8b:82:1f:4a	TCP	59979 > 1174 [SYN] Seq=0 Win=5840 Len=0 MSS=1460 SACK_PERM=1 TSval=3300147 TSecr=0 WS=64		10.42.42.50	10.42.42.253	74	168	4	2010-02-03 01:34:07	1174.0	59979.0	85.0
168	74	00:26:22:cb:1e:79	00:23:8b:82:1f:4a	TCP	45405 > 15003 [SYN] Seq=0 Win=5840 Len=0 MSS=1460 SACK_PERM=1 TSval=3300147 TSecr=0 WS=64		10.42.42.56	10.42.42.253	74	169	4	2010-02-03 01:34:07	15003.0	45405.0	86.0
169	60	00:23:8b:82:1f:4a	00:26:22:cb:1e:79	TCP	15003 > 45405 [RST, ACK] Seq=1 Ack=1 Win=0 Len=0		10.42.42.253	10.42.42.56	60	170	4	2010-02-03 01:34:07	45405.0	15003.0	86.0
170	60	00:23:8b:82:1f:4a	00:16:cb:92:6e:dc	TCP	9003 > 52141 [RST, ACK] Seq=1 Ack=1 Win=0 Len=0		10.42.42.253	10.42.42.25	60	171	4	2010-02-03 01:34:07	52141.0	9003.0	84.0
171	74	00:16:cb:92:6e:dc	00:23:8b:82:1f:4a	TCP	43819 > 555 [SYN] Seq=0 Win=5840 Len=0 MSS=1460 SACK_PERM=1 TSval=3300147 TSecr=0 WS=64		10.42.42.25	10.42.42.253	74	172	4	2010-02-03 01:34:07	555.0	43819.0	87.0
172	74	70:5a:b6:51:d7:b2	00:23:8b:82:1f:4a	TCP	47582 > 144 [SYN] Seq=0 Win=5840 Len=0 MSS=1460 SACK_PERM=1 TSval=3300147 TSecr=0 WS=64		10.42.42.50	10.42.42.253	74	173	4	2010-02-03 01:34:07	144.0	47582.0	88.0
173	74	00:26:22:cb:1e:79	00:23:8b:82:1f:4a	TCP	45967 > 16018 [SYN] Seq=0 Win=5840 Len=0 MSS=1460 SACK_PERM=1 TSval=3300147 TSecr=0 WS=64		10.42.42.56	10.42.42.253	74	174	4	2010-02-03 01:34:07	16018.0	45967.0	89.0
174	60	00:23:8b:82:1f:4a	00:16:cb:92:6e:dc	TCP	555 > 43819 [RST, ACK] Seq=1 Ack=1 Win=0 Len=0		10.42.42.253	10.42.42.25	60	175	4	2010-02-03 01:34:07	43819.0	555.0	87.0
175	60	00:23:8b:82:1f:4a	00:26:22:cb:1e:79	TCP	16018 > 45967 [RST, ACK] Seq=1 Ack=1 Win=0 Len=0		10.42.42.253	10.42.42.56	60	176	4	2010-02-03 01:34:07	45967.0	16018.0	89.0
176	74	00:16:cb:92:6e:dc	00:23:8b:82:1f:4a	TCP	44367 > 1174 [SYN] Seq=0 Win=5840 Len=0 MSS=1460 SACK_PERM=1 TSval=3300147 TSecr=0 WS=64		10.42.42.25	10.42.42.253	74	177	4	2010-02-03 01:34:07	1174.0	44367.0	90.0
177	74	70:5a:b6:51:d7:b2	00:23:8b:82:1f:4a	TCP	56258 > 15003 [SYN] Seq=0 Win=5840 Len=0 MSS=1460 SACK_PERM=1 TSval=3300147 TSecr=0 WS=64		10.42.42.50	10.42.42.253	74	178	4	2010-02-03 01:34:07	15003.0	56258.0	91.0
178	74	00:26:22:cb:1e:79	00:23:8b:82:1f:4a	TCP	35476 > 3971 [SYN] Seq=0 Win=5840 Len=0 MSS=1460 SACK_PERM=1 TSval=3300147 TSecr=0 WS=64		10.42.42.56	10.42.42.253	74	179	4	2010-02-03 01:34:07	3971.0	35476.0	92.0
179	60	00:23:8b:82:1f:4a	00:26:22:cb:1e:79	TCP	3971 > 35476 [RST, ACK] Seq=1 Ack=1 Win=0 Len=0		10.42.42.253	10.42.42.56	60	180	4	2010-02-03 01:34:07	35476.0	3971.0	92.0
180	60	00:23:8b:82:1f:4a	00:16:cb:92:6e:dc	TCP	1174 > 44367 [RST, ACK] Seq=1 Ack=1 Win=0 Len=0		10.42.42.253	10.42.42.25	60	181	4	2010-02-03 01:34:07	44367.0	1174.0	90.0
181	74	00:16:cb:92:6e:dc	00:23:8b:82:1f:4a	TCP	58410 > 144 [SYN] Seq=0 Win=5840 Len=0 MSS=1460 SACK_PERM=1 TSval=3300147 TSecr=0 WS=64		10.42.42.25	10.42.42.253	74	182	4	2010-02-03 01:34:07	144.0	58410.0	93.0
182	74	70:5a:b6:51:d7:b2	00:23:8b:82:1f:4a	TCP	58518 > 16018 [SYN] Seq=0 Win=5840 Len=0 MSS=1460 SACK_PERM=1 TSval=3300147 TSecr=0 WS=64		10.42.42.50	10.42.42.253	74	183	4	2010-02-03 01:34:07	16018.0	58518.0	94.0
183	74	00:26:22:cb:1e:79	00:23:8b:82:1f:4a	TCP	54513 > 3914 [SYN] Seq=0 Win=5840 Len=0 MSS=1460 SACK_PERM=1 TSval=3300147 TSecr=0 WS=64		10.42.42.56	10.42.42.253	74	184	4	2010-02-03 01:34:07	3914.0	54513.0	95.0
184	60	00:23:8b:82:1f:4a	00:26:22:cb:1e:79	TCP	3914 > 54513 [RST, ACK] Seq=1 Ack=1 Win=0 Len=0		10.42.42.253	10.42.42.56	60	185	4	2010-02-03 01:34:07	54513.0	3914.0	95.0
185	60	00:23:8b:82:1f:4a	00:16:cb:92:6e:dc	TCP	144 > 58410 [RST, ACK] Seq=1 Ack=1 Win=0 Len=0		10.42.42.253	10.42.42.25	60	186	4	2010-02-03 01:34:07	58410.0	144.0	93.0
186	74	00:16:cb:92:6e:dc	00:23:8b:82:1f:4a	TCP	51707 > 15003 [SYN] Seq=0 Win=5840 Len=0 MSS=1460 SACK_PERM=1 TSval=3300147 TSecr=0 WS=64		10.42.42.25	10.42.42.253	74	187	4	2010-02-03 01:34:07	15003.0	51707.0	96.0
187	74	70:5a:b6:51:d7:b2	00:23:8b:82:1f:4a	TCP	41279 > 3971 [SYN] Seq=0 Win=5840 Len=0 MSS=1460 SACK_PERM=1 TSval=3300147 TSecr=0 WS=64		10.42.42.50	10.42.42.253	74	188	4	2010-02-03 01:34:07	3971.0	41279.0	97.0
188	74	00:26:22:cb:1e:79	00:23:8b:82:1f:4a	TCP	37332 > 2030 [SYN] Seq=0 Win=5840 Len=0 MSS=1460 SACK_PERM=1 TSval=3300147 TSecr=0 WS=64		10.42.42.56	10.42.42.253	74	189	4	2010-02-03 01:34:07	2030.0	37332.0	98.0
189	60	00:23:8b:82:1f:4a	00:26:22:cb:1e:79	TCP	2030 > 37332 [RST, ACK] Seq=1 Ack=1 Win=0 Len=0		10.42.42.253	10.42.42.56	60	190	4	2010-02-03 01:34:07	37332.0	2030.0	98.0
190	60	00:23:8b:82:1f:4a	00:16:cb:92:6e:dc	TCP	15003 > 51707 [RST, ACK] Seq=1 Ack=1 Win=0 Len=0		10.42.42.253	10.42.42.25	60	191	4	2010-02-03 01:34:07	51707.0	15003.0	96.0
191	74	00:16:cb:92:6e:dc	00:23:8b:82:1f:4a	TCP	49068 > 16018 [SYN] Seq=0 Win=5840 Len=0 MSS=1460 SACK_PERM=1 TSval=3300147 TSecr=0 WS=64		10.42.42.25	10.42.42.253	74	192	4	2010-02-03 01:34:07	16018.0	49068.0	99.0
192	74	70:5a:b6:51:d7:b2	00:23:8b:82:1f:4a	TCP	54185 > 3914 [SYN] Seq=0 Win=5840 Len=0 MSS=1460 SACK_PERM=1 TSval=3300147 TSecr=0 WS=64		10.42.42.50	10.42.42.253	74	193	4	2010-02-03 01:34:07	3914.0	54185.0	100.0
193	74	00:26:22:cb:1e:79	00:23:8b:82:1f:4a	TCP	41984 > 1862 [SYN] Seq=0 Win=5840 Len=0 MSS=1460 SACK_PERM=1 TSval=3300147 TSecr=0 WS=64		10.42.42.56	10.42.42.253	74	194	4	2010-02-03 01:34:07	1862.0	41984.0	101.0
194	60	00:23:8b:82:1f:4a	00:16:cb:92:6e:dc	TCP	16018 > 49068 [RST, ACK] Seq=1 Ack=1 Win=0 Len=0		10.42.42.253	10.42.42.25	60	195	4	2010-02-03 01:34:07	49068.0	16018.0	99.0
195	60	00:23:8b:82:1f:4a	00:26:22:cb:1e:79	TCP	1862 > 41984 [RST, ACK] Seq=1 Ack=1 Win=0 Len=0		10.42.42.253	10.42.42.56	60	196	4	2010-02-03 01:34:07	41984.0	1862.0	101.0
196	74	00:16:cb:92:6e:dc	00:23:8b:82:1f:4a	TCP	49584 > 3971 [SYN] Seq=0 Win=5840 Len=0 MSS=1460 SACK_PERM=1 TSval=3300147 TSecr=0 WS=64		10.42.42.25	10.42.42.253	74	197	4	2010-02-03 01:34:07	3971.0	49584.0	102.0
197	74	70:5a:b6:51:d7:b2	00:23:8b:82:1f:4a	TCP	46756 > 2030 [SYN] Seq=0 Win=5840 Len=0 MSS=1460 SACK_PERM=1 TSval=3300148 TSecr=0 WS=64		10.42.42.50	10.42.42.253	74	198	4	2010-02-03 01:34:07	2030.0	46756.0	103.0
198	60	00:23:8b:82:1f:4a	00:16:cb:92:6e:dc	TCP	3971 > 49584 [RST, ACK] Seq=1 Ack=1 Win=0 Len=0		10.42.42.253	10.42.42.25	60	199	4	2010-02-03 01:34:07	49584.0	3971.0	102.0
199	74	00:26:22:cb:1e:79	00:23:8b:82:1f:4a	TCP	57686 > 9418 [SYN] Seq=0 Win=5840 Len=0 MSS=1460 SACK_PERM=1 TSval=3300148 TSecr=0 WS=64		10.42.42.56	10.42.42.253	74	200	4	2010-02-03 01:34:07	9418.0	57686.0	104.0
200	60	00:23:8b:82:1f:4a	00:26:22:cb:1e:79	TCP	9418 > 57686 [RST, ACK] Seq=1 Ack=1 Win=0 Len=0		10.42.42.253	10.42.42.56	60	201	4	2010-02-03 01:34:07	57686.0	9418.0	104.0
201	74	00:16:cb:92:6e:dc	00:23:8b:82:1f:4a	TCP	60511 > 3914 [SYN] Seq=0 Win=5840 Len=0 MSS=1460 SACK_PERM=1 TSval=3300148 TSecr=0 WS=64		10.42.42.25	10.42.42.253	74	202	4	2010-02-03 01:34:07	3914.0	60511.0	105.0
202	60	00:23:8b:82:1f:4a	70:5a:b6:51:d7:b2	TCP	9003 > 39488 [RST, ACK] Seq=1 Ack=1 Win=0 Len=0		10.42.42.253	10.42.42.50	60	203	4	2010-02-03 01:34:07	39488.0	9003.0	79.0
203	60	00:23:8b:82:1f:4a	70:5a:b6:51:d7:b2	TCP	555 > 34068 [RST, ACK] Seq=1 Ack=1 Win=0 Len=0		10.42.42.253	10.42.42.50	60	204	4	2010-02-03 01:34:07	34068.0	555.0	82.0
204	60	00:23:8b:82:1f:4a	70:5a:b6:51:d7:b2	TCP	1174 > 59979 [RST, ACK] Seq=1 Ack=1 Win=0 Len=0		10.42.42.253	10.42.42.50	60	205	4	2010-02-03 01:34:07	59979.0	1174.0	85.0
205	74	70:5a:b6:51:d7:b2	00:23:8b:82:1f:4a	TCP	50516 > 1862 [SYN] Seq=0 Win=5840 Len=0 MSS=1460 SACK_PERM=1 TSval=3300148 TSecr=0 WS=64		10.42.42.50	10.42.42.253	74	206	4	2010-02-03 01:34:07	1862.0	50516.0	106.0
206	60	00:23:8b:82:1f:4a	70:5a:b6:51:d7:b2	TCP	144 > 47582 [RST, ACK] Seq=1 Ack=1 Win=0 Len=0		10.42.42.253	10.42.42.50	60	207	4	2010-02-03 01:34:07	47582.0	144.0	88.0
207	74	00:26:22:cb:1e:79	00:23:8b:82:1f:4a	TCP	52783 > 800 [SYN] Seq=0 Win=5840 Len=0 MSS=1460 SACK_PERM=1 TSval=3300148 TSecr=0 WS=64		10.42.42.56	10.42.42.253	74	208	4	2010-02-03 01:34:07	800.0	52783.0	107.0
208	60	00:23:8b:82:1f:4a	00:16:cb:92:6e:dc	TCP	3914 > 60511 [RST, ACK] Seq=1 Ack=1 Win=0 Len=0		10.42.42.253	10.42.42.25	60	209	4	2010-02-03 01:34:07	60511.0	3914.0	105.0
209	60	00:23:8b:82:1f:4a	70:5a:b6:51:d7:b2	TCP	15003 > 56258 [RST, ACK] Seq=1 Ack=1 Win=0 Len=0		10.42.42.253	10.42.42.50	60	210	4	2010-02-03 01:34:07	56258.0	15003.0	91.0
